id,name,full_name,owner_id,organization_id,description,homepage,language,private,fork,default_branch,size,stargazers_count,watchers_count,forks_count,open_issues_count,contributors_count,commits_count,pull_requests_count,created_at,updated_at,pushed_at
15945567,angular-ui-router-anim-in-out,homerjam/angular-ui-router-anim-in-out,1055769,,An animation directive to use with ngAnimate 1.2+ and ui-router,http://homerjam.github.io/angular-ui-router-anim-in-out/,CSS,False,False,master,3943,234,234,49,6,0,44,4,2014-01-15 19:25:29,2025-03-05 20:40:24,2016-03-14 10:57:50
15945573,blip,tidepool-org/blip,4390820,4390820,"Blip is the internal name for Tidepool for Web, a tool for seeing diabetes data in one place.",https://tidepool.org/products/tidepool/,JavaScript,False,False,develop,69654,109,109,56,43,0,10720,1535,2014-01-15 19:25:43,2025-04-17 13:11:38,2025-04-22 02:45:43
15946769,express-statsd,uber-archive/express-statsd,14817478,14817478,Statsd route monitoring middleware for connect/express,,JavaScript,False,False,master,14,126,126,21,5,0,11,8,2014-01-15 20:10:22,2025-01-26 15:05:02,2020-03-18 21:24:58
15947246,RFRateMe,rfunk82/RFRateMe,1272868,,"RFRateMe will help you promote your iPhone/iPad app without irritating your users. It's very simple to install, use and configure (If you need to change the default behavior).",www.ideveloperblog.com,Objective-C,False,False,master,77,149,149,20,1,0,34,2,2014-01-15 20:26:04,2024-02-12 07:36:36,2017-12-30 20:21:03
15947557,ots,khaledhosny/ots,93914,,Sanitizer for OpenType,,C++,False,False,main,42566,278,278,67,17,0,1007,137,2014-01-15 20:36:53,2025-04-15 08:09:44,2025-03-29 03:57:49
15947609,buddy,funcool/buddy,10117366,10117366,Security library for Clojure,,Clojure,False,False,master,552,830,830,38,4,0,479,25,2014-01-15 20:38:23,2024-12-16 07:15:20,2021-05-28 14:53:05
15947924,IonIconView,MarsVard/IonIconView,2356995,,IonIconView based on the awesome icons provided by ionicons.com,,Java,False,False,master,7947,274,274,42,1,0,17,0,2014-01-15 20:50:05,2025-03-22 03:59:47,2014-03-19 08:50:21
15948977,react-starter-template,johnthethird/react-starter-template,125546,,"React (reactjs), Gulp, Webpack, Bootstrap, LiveReload, all tied up in a bow.",,CoffeeScript,False,False,master,678,176,176,31,3,0,11,2,2014-01-15 21:28:03,2021-05-07 15:45:06,2014-08-03 17:43:09
15949777,beast2,CompEvol/beast2,3868633,3868633,Bayesian Evolutionary Analysis by Sampling Trees,www.beast2.org,Java,False,False,master,98184,247,247,83,187,0,3049,89,2014-01-15 21:56:41,2025-04-18 01:41:02,2025-04-18 01:40:58
15949792,zzarchive-Vulpes,fsprojects-archive/zzarchive-Vulpes,11925667,11925667,"Vulpes: a Deep Belief Net written in F#, and using Alea.cuBase to access the GPU.",,JavaScript,False,False,master,108024,116,116,18,2,0,199,2,2014-01-15 21:57:24,2023-02-15 22:25:37,2017-08-14 12:37:15
15949890,linuxupskillchallenge,snori74/linuxupskillchallenge,2436188,,Learn the skills required to sysadmin a remote Linux server from the commandline.,,Shell,False,False,master,693,3399,3399,593,0,0,691,50,2014-01-15 22:01:13,2025-04-17 09:30:15,2021-03-01 02:13:21
15950369,berkeley,thehackerwithin/berkeley,1369722,1369722,The Hacker Within at the University of California - Berkeley,http://www.thehackerwithin.org/berkeley/,Jupyter Notebook,False,False,master,55826,100,100,94,19,0,630,104,2014-01-15 22:18:56,2025-01-23 17:43:57,2023-05-01 20:13:30
15950972,Tuff.gb,BonsaiDen/Tuff.gb,124674,,Tuff - An original game for the Nintendo GameBoy,http://bonsaiden.github.io/Tuff.gb/,Assembly,False,False,master,1275,307,307,11,5,0,516,1,2014-01-15 22:37:56,2025-03-08 21:10:28,2018-10-27 20:29:49
15951025,mosh-chrome,rpwoodbu/mosh-chrome,1192829,,Mosh for Chrome,,C++,False,False,master,2640,373,373,59,73,0,273,20,2014-01-15 22:40:24,2025-02-28 23:35:21,2024-10-07 10:03:30
15951701,simmerjs,gmmorris/simmerjs,386208,,A pure Javascript reverse CSS selector engine which calculates a DOM element's unique CSS selector on the current page.,http://gmmorris.github.io/simmerjs/,JavaScript,False,False,master,489,161,161,21,8,0,86,5,2014-01-15 23:08:52,2025-02-19 17:06:15,2021-03-26 06:59:57
15953006,gulp-include,wiledal/gulp-include,1035169,,Enables functionality similar to that of snockets / sprockets or other file insertion compilation tools.,,JavaScript,False,False,master,310,156,156,67,24,0,90,45,2014-01-16 00:10:11,2025-04-13 14:13:27,2022-09-09 07:40:59
15953160,droidsec.github.io,droidsec/droidsec.github.io,6414807,6414807,The droidsec web site!,http://www.droidsec.org/,HTML,False,False,master,1611,171,171,80,14,0,358,72,2014-01-16 00:19:09,2024-10-16 21:23:55,2024-09-19 22:38:39
15953199,youmightnotneedjquery,HubSpot/youmightnotneedjquery,326419,326419,,http://YouMightNotNeedjQuery.com,Astro,False,False,dev,545,14207,14207,535,14,0,404,213,2014-01-16 00:21:17,2025-04-21 13:25:29,2024-07-12 14:59:55
15954494,laravel-shop-menu,msurguy/laravel-shop-menu,585833,,"Menu ordering/management application demo, like Wordpress menu manager",http://laravel-menu-builder.gopagoda.com/admin/menu,PHP,False,False,master,699,335,335,98,5,0,5,0,2014-01-16 01:27:04,2025-03-04 17:38:33,2014-01-16 08:38:19
15955025,angular-foundation,yalabot/angular-foundation,8482210,8482210,,http://pineconellc.github.io/angular-foundation/,JavaScript,False,False,master,1660,1049,1049,264,80,0,344,116,2014-01-16 01:56:15,2025-01-29 05:50:34,2019-10-01 07:24:45
15956497,AlloyDesigner,AlloyTeam/AlloyDesigner,1503033,1503033,AlloyDesigner是一款致力于提高前端生产效率的浏览器内运行工具，AlloyDesigner + Chrome F12(Especially with WorkSpace)  打造前端新的开发和测试模式,http://alloyteam.github.io/AlloyDesigner/,,False,False,master,7235,138,138,28,10,0,4,1,2014-01-16 03:10:56,2023-07-11 01:20:30,2017-04-17 00:46:39
15956656,BaiduPCS,GangZhuo/BaiduPCS,1397462,,百度网盘命令行工具。The terminal utility for Baidu Network Disk.,,Roff,False,False,master,1633,3512,3512,717,109,0,636,30,2014-01-16 03:19:41,2025-04-19 15:49:59,2020-12-15 10:11:10
15957187,termcoin,chjj/termcoin,470564,,A bitcoin wallet and blockchain explorer for your terminal.,,JavaScript,False,False,master,1033,480,480,33,11,0,258,5,2014-01-16 03:48:22,2025-04-07 20:11:21,2024-02-21 16:10:33
15957608,app-protocol-filter-deprecated,clearos/app-protocol-filter-deprecated,1750642,1750642,This has been deprecated by a new protocol filter powered by Netify,https://www.netify.ai/resources/developer/netifyd,PHP,False,False,master,66,233,233,18,0,0,41,0,2014-01-16 04:12:15,2024-07-22 21:27:50,2018-08-19 15:19:34
15957792,nrjavaserial,NeuronRobotics/nrjavaserial,6283182,6283182,A Java Serial Port system. This is a fork of the RXTX project that uses in jar loading of the native code.,,Java,False,False,master,8468,347,347,147,48,0,864,87,2014-01-16 04:22:03,2025-03-02 18:31:00,2024-02-09 11:36:24
15958352,django-rest-framework-jwt,jpadilla/django-rest-framework-jwt,83319,,JSON Web Token Authentication support for Django REST Framework,http://jpadilla.github.io/django-rest-framework-jwt/,Python,False,False,master,783,3186,3186,656,163,0,369,190,2014-01-16 04:54:06,2025-04-11 21:05:17,2022-12-06 16:30:54
15958676,simplify,CalebFenton/simplify,1356658,,Android virtual machine and deobfuscator,,Java,False,False,master,103553,4529,4529,449,32,0,915,19,2014-01-16 05:14:02,2025-04-22 06:47:44,2022-04-30 12:20:33
15959248,fountain-mode,rnkn/fountain-mode,1256849,,Emacs major mode for screenwriting in Fountain plain-text markup,https://fountain-mode.org,Emacs Lisp,False,False,master,4816,411,411,16,3,0,2266,17,2014-01-16 05:45:05,2025-04-07 21:19:02,2024-11-06 02:20:26
15959421,Dualx,Donkil/Dualx,6369345,6369345,QQ Client for Chrome.,,JavaScript,False,False,master,1038,117,117,20,9,0,5,1,2014-01-16 05:55:06,2024-11-19 08:23:16,2017-04-18 02:29:48
15959613,emacsql,magit/emacsql,750076,750076,A high-level Emacs Lisp front-end for SQLite,,Emacs Lisp,False,False,main,4299,586,586,44,0,0,546,44,2014-01-16 06:06:21,2025-04-14 04:45:53,2025-04-01 15:11:47
15961085,generator-angular-flask,rayokota/generator-angular-flask,1761488,,Yeoman generator for AngularJS + Flask ,,Python,False,False,master,359,203,203,35,3,0,25,5,2014-01-16 07:26:15,2024-09-04 09:46:45,2015-05-26 22:22:24
15961224,drive-zipextractor,googlearchive/drive-zipextractor,12502296,12502296,Extract (decompress) ZIP files into Google Drive using the Google Drive API,,JavaScript,False,False,master,762,442,442,287,6,0,129,7,2014-01-16 07:34:27,2024-12-25 09:47:58,2021-06-15 22:35:47
15961288,Android-DraggableGridViewPager,zzhouj/Android-DraggableGridViewPager,2587801,,"Zaker style grid view pager, support dragging & rearrange, using as zaker's main screen.",,Java,False,False,master,1395,199,199,71,2,0,9,0,2014-01-16 07:38:42,2025-02-07 05:02:41,2014-02-22 15:28:43
15961579,GeoTimeZone,mattjohnsonpint/GeoTimeZone,1396388,,Provides an IANA time zone identifier from latitude and longitude coordinates.,,C#,False,False,main,192784,241,241,44,2,0,197,8,2014-01-16 07:54:17,2025-04-15 03:45:35,2025-02-13 03:02:42
15961960,MMAppSwitcher,vpdn/MMAppSwitcher,387312,,Replace iOS7 app switcher view with your own customized card view.,,Objective-C,False,False,master,228,1055,1055,44,2,0,15,1,2014-01-16 08:15:25,2025-02-14 15:51:46,2015-02-06 09:37:56
15962445,wla-dx,vhelin/wla-dx,6417746,,WLA DX - Yet Another GB-Z80/Z80/Z80N/6502/65C02/65CE02/65816/68000/6800/6801/6809/8008/8080/HUC6280/SPC-700/SuperFX Multi Platform Cross Assembler Package,,C,False,False,master,7031,560,560,99,46,0,1826,206,2014-01-16 08:39:58,2025-04-21 22:08:36,2025-04-21 22:08:30
15962809,APSmartStorage,Alterplay/APSmartStorage,902731,902731,The smartest storage for network resources,,Objective-C,False,False,master,428,335,335,23,0,0,80,0,2014-01-16 08:57:10,2024-01-20 16:56:49,2015-02-27 15:04:14
15962994,nodetunes,stephen/nodetunes,2320890,,AirTunes v2 Server implementation,,JavaScript,False,False,master,202,215,215,65,28,0,135,22,2014-01-16 09:05:24,2024-09-22 13:15:16,2017-12-16 12:33:00
15964081,webkit.js,trevorlinton/webkit.js,3111873,,Pure JavaScript Port of WebKit,,,False,False,master,840022,1951,1951,87,28,0,205,10,2014-01-16 09:54:37,2025-03-31 13:22:58,2018-12-30 11:11:10
15964292,Stripe,ServiceStack/Stripe,605728,605728,Typed .NET clients for stripe.com REST APIs,,C#,False,False,master,17508,194,194,67,3,0,294,18,2014-01-16 10:03:59,2024-10-23 23:33:17,2022-02-16 05:40:36
15964309,angular-summernote,outsideris/angular-summernote,390146,,AngularJS directive to Summernote,,JavaScript,False,False,master,160,336,336,128,93,0,183,28,2014-01-16 10:04:35,2024-12-18 17:05:57,2020-03-25 16:38:28
15964521,zer0m0n,conix-security/zer0m0n,6230767,,zer0m0n driver for cuckoo sandbox,,C,False,False,master,2143,359,359,143,5,0,95,4,2014-01-16 10:14:40,2025-04-17 00:37:44,2015-05-19 13:43:01
15965229,Magipack.js,keitakun/Magipack.js,976296,,Miminize HTTP requests using Magipack.js,https://github.com/keitakun/Magipack.js,JavaScript,False,False,master,429,104,104,10,3,0,15,4,2014-01-16 10:48:47,2025-04-13 12:59:42,2014-10-05 19:06:02
15966223,contra,bevacqua/contra,934293,,:surfer: Asynchronous flow control with a functional taste to it,https://ponyfoo.com,JavaScript,False,False,master,283,779,779,27,1,0,261,7,2014-01-16 11:41:17,2025-03-23 14:42:16,2024-03-16 02:11:28
15966619,butterfly,paradoxxxzero/butterfly,271144,,A web terminal based on websocket and tornado,http://paradoxxxzero.github.io/2014/02/28/butterfly.html,CoffeeScript,False,False,master,2426,2895,2895,312,87,0,401,50,2014-01-16 12:01:44,2025-03-21 12:25:36,2020-05-25 04:55:13
15967193,Parrot-Refactoring-Kata,emilybache/Parrot-Refactoring-Kata,48844,,Kata to learn about Polymorphism,https://youtu.be/UxNEHKg_2eA,XSLT,False,False,main,446,125,125,198,0,0,270,50,2014-01-16 12:29:53,2025-04-19 18:52:48,2025-04-19 18:52:43
15967474,health-monitor-rails,lbeder/health-monitor-rails,2841614,,A Rails plugin which provides a health checking and monitoring API of various services and application aspects.,,Ruby,False,False,master,673,217,217,60,5,0,589,99,2014-01-16 12:44:33,2025-04-19 14:19:33,2025-04-19 14:20:31
15967838,iomad,iomad/iomad,5493428,,Iomad,,PHP,False,False,IOMAD_405_STABLE,633539,166,166,234,46,0,119703,117,2014-01-16 13:01:41,2025-04-18 14:57:37,2025-04-18 14:57:33
15967933,bootcards,bootcards/bootcards,6348753,6348753,No longer maintained. See below for details.,,CSS,False,False,master,5401,1028,1028,150,20,0,168,9,2014-01-16 13:05:04,2025-03-19 14:17:03,2017-09-07 12:07:43
15968350,smart-private-npm,godaddy/smart-private-npm,1406546,1406546,"An intelligent routing proxy for npm with support for: private, whitelisted, and blacklisted packaged",,JavaScript,False,False,main,79,138,138,16,6,0,107,21,2014-01-16 13:21:30,2025-01-11 00:49:31,2023-05-18 18:37:54
15968733,coop,rakyll/coop,108380,,Cheat sheet for some of the common concurrent flows in Go,,Go,False,False,master,234,1204,1204,45,5,0,20,7,2014-01-16 13:37:46,2025-03-05 16:57:35,2015-10-06 15:47:03
15969751,clortex,htm-community/clortex,8866221,8866221,(pre-alpha) Implementation of Jeff Hawkins' Hierarchical Temporal Memory & Cortical Learning Algorithm,http://fergalbyrne.github.io,Clojure,False,False,master,84282,182,182,18,11,0,56,2,2014-01-16 14:15:32,2024-12-01 14:21:59,2015-12-02 14:02:02
15969892,StoreDB,djyde/StoreDB,914329,,[DEPRECATED] Make localStorage do more things.,,JavaScript,False,False,master,22,330,330,46,3,0,36,8,2014-01-16 14:20:36,2023-08-11 09:35:10,2017-08-10 03:17:41
15970107,OpenRTB,openrtb/OpenRTB,3360076,3360076,Documentation and issue tracking for the OpenRTB Project,,,False,False,master,23965,865,865,143,21,0,59,3,2014-01-16 14:29:20,2025-04-02 11:54:27,2016-08-29 21:36:06
15970512,jpeg-js,jpeg-js/jpeg-js,77503251,77503251,A pure javascript JPEG encoder and decoder for node.js,,JavaScript,False,False,master,6068,573,573,124,25,0,91,47,2014-01-16 14:44:39,2025-04-17 15:57:42,2024-09-08 01:30:25
15970764,dnn,junku901/dnn,5094875,,"Deep learning library for node.js. (Includes Logistic-Regression, MLP, RBM, DBN, CRBM, CDBN)",,JavaScript,False,False,master,21,169,169,29,4,0,5,0,2014-01-16 14:52:57,2024-10-15 06:21:16,2016-09-25 06:30:04
15970855,ping-play,brikis98/ping-play,711908,,BigPipe streaming for the Play Framework,,Scala,False,False,master,32600,307,307,59,10,0,134,5,2014-01-16 14:55:36,2024-08-29 05:41:27,2016-11-06 23:25:42
15971461,rakam-api,rakam-io/rakam-api,18196166,18196166,"📈 Collect customer event data from your apps. (Note that this project only includes the API collector, not the visualization platform)",https://rakam.io,Java,False,False,master,27933,799,799,102,13,0,1762,49,2014-01-16 15:17:09,2025-04-20 18:54:59,2021-11-13 01:21:45
15971519,cmake-init,cginternals/cmake-init,13125552,13125552,"Template for reliable, cross-platform C++ project setup using cmake.",,CMake,False,False,master,2517,922,922,117,25,0,467,60,2014-01-16 15:19:15,2025-04-16 17:42:02,2025-04-14 13:20:15
15971562,An-Introduction-To-Applied-Bioinformatics,applied-bioinformatics/An-Introduction-To-Applied-Bioinformatics,42248749,42248749,Interactive lessons in bioinformatics.,http://readIAB.org,Python,False,False,master,19407,834,834,314,44,0,818,199,2014-01-16 15:20:11,2025-04-10 03:22:04,2021-07-19 17:08:21
15972887,gulp-useref,jonkemp/gulp-useref,230683,,Parse build blocks in HTML files to replace references to non-optimized scripts or stylesheets.,,JavaScript,False,False,master,586,704,704,89,39,0,271,60,2014-01-16 16:05:58,2025-04-19 19:55:35,2022-03-27 18:50:12
15973085,d3-tutorials,uwdata/d3-tutorials,5448960,5448960,D3 Tutorials for CSE512 Data Visualization Course at University of Washington,http://uwdata.github.io/d3-tutorials,HTML,False,False,gh-pages,3053,171,171,42,1,0,64,3,2014-01-16 16:13:04,2025-03-07 18:50:24,2018-10-19 20:15:44
15973389,JSSImporter,jssimporter/JSSImporter,40366553,40366553,JSSImporter is deprecated. Please see the wiki for alternatives,,Python,False,False,master,1063,146,146,38,12,0,392,46,2014-01-16 16:23:50,2025-02-16 22:33:06,2023-04-17 11:09:45
15973714,imgly-sdk-html5,imgly/imgly-sdk-html5,51164587,51164587,The most comprehensive  photo editor SDK  for web and mobile,https://www.photoeditorsdk.com,,False,False,master,7,574,574,116,0,0,2,10,2014-01-16 16:34:24,2025-04-12 14:36:45,2020-09-29 12:28:28
15973741,pesdk-ios-examples,imgly/pesdk-ios-examples,51164587,51164587,A fully customizable photo editor for your app.,https://www.photoeditorsdk.com,,False,False,master,46279,854,854,161,8,0,68,58,2014-01-16 16:35:25,2025-03-31 10:27:46,2022-07-01 15:53:14
15973764,feedly-api,kbariotis/feedly-api,605742,,PHP wrapper around Feedly's REST API,,PHP,False,False,master,103,122,122,31,1,0,113,20,2014-01-16 16:36:18,2024-01-25 19:23:42,2021-03-07 19:48:47
15974409,docs-travis-ci-com,travis-ci/docs-travis-ci-com,639823,639823,The Travis CI Documentation,http://docs.travis-ci.com,HTML,False,False,master,35674,603,603,3282,83,0,9549,2582,2014-01-16 16:57:49,2025-04-15 14:27:06,2025-04-16 15:03:22
15974518,tedit,creationix/tedit,89353,,Chrome app for tedit,https://chrome.google.com/webstore/detail/tedit-development-environ/ooekdijbnbbjdfjocaiflnjgoohnblgf,JavaScript,False,False,master,3176,188,188,27,32,0,608,3,2014-01-16 17:02:11,2024-05-19 21:07:40,2017-04-23 04:17:16
15975439,scrollreveal,jlmakes/scrollreveal,2044842,,Animate elements as they scroll into view.,https://scrollrevealjs.org/,JavaScript,False,False,master,1140,22495,22495,2247,42,0,950,56,2014-01-16 17:37:20,2025-04-22 09:57:49,2024-04-05 17:55:48
15976429,JMeter-WebSocketSampler,fshutdown/JMeter-WebSocketSampler,6422181,,JMeter - WebSocket Sampler,,Java,False,False,master,51,312,312,188,61,0,24,13,2014-01-16 18:10:44,2025-04-07 09:11:21,2021-08-31 15:12:57
15978688,exorcist,thlorenz/exorcist,192891,,Externalizes the source map found inside a stream to an external .js.map file,https://www.patreon.com/bePatron?u=8663953,JavaScript,False,False,master,49,331,331,34,1,0,50,25,2014-01-16 19:32:38,2025-01-17 18:47:17,2023-02-07 08:43:04
15979175,ncpa,NagiosEnterprises/ncpa,5666660,5666660,Nagios Cross-Platform Agent,,Python,False,False,master,172772,189,189,94,289,0,2964,282,2014-01-16 19:52:04,2025-04-20 21:17:16,2025-04-17 15:32:04
15980298,nagios-plugins,nagios-plugins/nagios-plugins,6423460,6423460,Nagios Plugins,,C,False,False,master,13906,373,373,336,211,0,3890,303,2014-01-16 20:40:26,2025-04-20 21:17:01,2024-10-07 22:09:59
15980440,ProPPR,TeamCohen/ProPPR,2047386,2047386,Graph-algorithm inferences over local groundings of first-order logic programs,,Java,False,False,working,75926,134,134,49,2,0,801,5,2014-01-16 20:45:50,2025-01-17 07:47:38,2017-11-04 03:00:36
15980519,go-js-dom,dominikh/go-js-dom,39825,,,,Go,False,False,master,444,263,263,42,22,0,133,40,2014-01-16 20:49:26,2025-03-23 10:08:28,2025-03-04 18:19:26
15981035,node-webkit-hipster-seed,Anonyfox/node-webkit-hipster-seed,1140758,,Bootstrap a crossplatform Desktop Application using tools you probably never heard of. ,,CSS,False,False,master,328,1290,1290,81,11,0,44,4,2014-01-16 21:08:23,2025-03-05 22:25:45,2017-05-04 12:41:02
15981201,NHotkey,thomaslevesque/NHotkey,1864281,,A managed library to handle global hotkeys in Windows Forms and WPF applications,,C#,False,False,master,70,323,323,55,4,0,52,8,2014-01-16 21:15:47,2025-04-07 07:49:13,2024-07-04 01:26:49
15981212,rez,bamiaux/rez,2118909,,Image resizing in pure Go and SIMD,,Go,False,False,master,275,213,213,19,1,0,110,2,2014-01-16 21:16:15,2024-08-19 07:55:14,2017-07-31 18:51:31
15982638,train-detector,openalpr/train-detector,5896442,5896442,Input files and scripts necessary to train the license plate detector.,,Python,False,False,master,489822,125,125,164,26,0,23,8,2014-01-16 22:13:19,2024-10-10 02:16:36,2020-04-15 10:26:53
15983326,train-ocr,openalpr/train-ocr,5896442,5896442,Input files and scripts necessary to train the license plate OCR,,Python,False,False,master,14669,236,236,109,32,0,25,7,2014-01-16 22:42:57,2025-03-13 21:52:10,2020-01-28 20:31:24
15983348,gulp-newer,tschaub/gulp-newer,41094,,Pass through newer source files only,https://npmjs.org/package/gulp-newer,JavaScript,False,False,master,82,226,226,23,29,0,85,39,2014-01-16 22:43:53,2025-01-14 05:40:18,2020-11-26 14:19:52
15983412,ebook-javaee,algaworks/ebook-javaee,797058,797058,Projeto do e-book de Java EE 7 da AlgaWorks.,http://alga.works/livro-javaee/,Java,False,False,master,239,147,147,120,1,0,3,0,2014-01-16 22:46:51,2024-10-22 16:36:18,2015-02-25 02:54:16
15983484,go,cloudflare/go,314135,314135,Go with Cloudflare experimental patches,,Go,False,False,cf,277043,344,344,59,18,0,59048,129,2014-01-16 22:50:12,2025-04-19 03:17:35,2025-02-20 17:21:21
15983912,kickflip-ios-sdk,Kickflip/kickflip-ios-sdk,6173668,6173668,Kickflip iOS SDK,http://kickflip.io,Objective-C,False,False,master,530,347,347,143,44,0,77,5,2014-01-16 23:08:37,2024-12-11 22:44:17,2016-02-12 19:40:05
15984388,webgl,gopherjs/webgl,6654647,6654647,Gopherjs binding to the webgl context,,Go,False,False,master,25,112,112,16,6,0,28,10,2014-01-16 23:27:27,2024-05-17 16:41:48,2018-11-08 08:14:32
15984545,wordpress-multi-env-config,studio24/wordpress-multi-env-config,783657,783657,WordPress multi-environment config,,PHP,False,False,main,78,787,787,97,3,0,62,22,2014-01-16 23:35:22,2025-03-24 21:41:32,2025-03-24 21:41:28
15985153,Couscous,CouscousPHP/Couscous,9566021,9566021,Couscous is good.,https://couscous.io,PHP,False,False,master,28011,836,836,103,49,0,548,124,2014-01-17 00:06:26,2025-04-18 08:59:33,2024-08-01 22:05:46
15985433,Bitmarkets,VoluntaryLabs/Bitmarkets,42555053,42555053,OSX app for Bitmarkets decentralized marketplace,,Objective-C,False,False,master,2954,111,111,24,9,0,495,4,2014-01-17 00:21:14,2024-07-25 15:08:50,2016-04-12 03:44:54
15986050,node-pptp,laverdet/node-pptp,128856,,Experimental PPTP VPN server written in NodeJS,,JavaScript,False,False,master,102,139,139,30,2,0,1,1,2014-01-17 00:53:58,2025-03-27 19:37:20,2016-04-05 18:12:09
15986209,CBE20255,jckantor/CBE20255,3244555,,Introduction to Chemical Engineering Analysis,http://jckantor.github.io/CBE20255/,Jupyter Notebook,False,False,master,59384,178,178,83,1,0,705,2,2014-01-17 01:02:11,2025-04-20 19:05:04,2019-06-28 16:38:06
15987081,postcodes.io,ideal-postcodes/postcodes.io,4996310,4996310,"UK postcode & geolocation API, serving up open data",https://postcodes.io,TypeScript,False,False,master,129528,1287,1287,260,19,0,1888,1005,2014-01-17 01:48:53,2025-04-22 09:59:30,2025-04-17 13:51:57
15988336,free-programming-books,stormzhang/free-programming-books,2267900,,Free Learning Resources In Chinese,http://stormzhang.github.io/,,False,False,master,69474,892,892,345,3,0,14,2,2014-01-17 02:52:55,2025-04-07 00:25:47,2018-01-02 01:39:57
15989210,Android-Next,mcxiaoke/Android-Next,464330,,Android Next 公共组件库,http://mcxiaoke.github.io/Android-Next,Java,False,False,master,2322,765,765,195,0,0,447,7,2014-01-17 03:36:40,2025-01-16 10:26:01,2021-01-17 02:57:23
15990209,php-snapchat,JorgenPhi/php-snapchat,3020272,,A PHP library for the Snapchat API - With Commit History,,PHP,False,False,master,331,260,260,74,73,0,122,18,2014-01-17 04:38:42,2024-12-20 07:15:30,2024-05-05 00:37:16
15991457,openssh-portable,openssh/openssh-portable,2387206,2387206,Portable OpenSSH,,C,False,False,master,29688,3317,3317,1868,122,0,12951,549,2014-01-17 05:53:25,2025-04-22 01:07:31,2025-04-20 04:46:03
15992071,email-autocomplete,yongzhenlow/email-autocomplete,1645773,,A jQuery plugin that suggests and autocompletes the domain in email fields.,http://yongzhenlow.github.io/email-autocomplete/demo/,JavaScript,False,False,master,86,274,274,50,1,0,60,9,2014-01-17 06:30:33,2024-10-06 19:30:38,2020-08-25 04:13:02
15992077,vim-wordy,preservim/vim-wordy,56785356,56785356,Uncover usage problems in your writing,,Vim script,False,False,master,532,722,722,22,14,0,94,11,2014-01-17 06:30:49,2025-04-07 18:27:28,2022-02-13 12:37:47
15992245,run-sequence,OverZealous/run-sequence,965719,,Run a series of dependent gulp tasks in order,,JavaScript,False,False,master,104,957,957,56,0,0,91,26,2014-01-17 06:42:49,2025-04-19 19:55:25,2018-01-03 16:21:47
15992970,rust-phf,rust-phf/rust-phf,85801600,85801600,Compile time static maps for Rust,,Rust,False,False,master,2980,1914,1914,122,31,0,806,203,2014-01-17 07:23:04,2025-04-17 14:58:29,2025-02-02 10:06:12
15993452,WeChatPHP-SDK,zemzheng/WeChatPHP-SDK,650956,,SDK to admin.wechat.com for php,,PHP,False,False,master,698,103,103,30,0,0,34,2,2014-01-17 07:51:37,2023-03-23 15:03:10,2014-12-21 16:30:31
15993609,couchdb-documentation,apache/couchdb-documentation,47359,47359,Apache CouchDB Documentation,http://docs.couchdb.org/en/latest,,False,False,main,7118,147,147,223,0,0,1331,620,2014-01-17 08:00:08,2023-07-21 06:55:56,2022-09-09 05:17:00
15993612,couchdb-fauxton,apache/couchdb-fauxton,47359,47359,Fauxton is the new Web UI for CouchDB,https://github.com/apache/couchdb-fauxton,JavaScript,False,False,main,14699,395,395,225,72,0,2059,1288,2014-01-17 08:00:08,2025-04-10 18:54:38,2025-04-08 21:01:36
15994288,olympos,ivandoric/olympos,6043540,,"This is just empty theme for starting your Wordpress projects, with built in support for Sass, Susy and Gulp.js.",,CSS,False,False,master,1330,102,102,46,2,0,23,2,2014-01-17 08:35:36,2022-11-24 12:39:25,2018-02-15 08:56:20
15994566,zamia-ai,gooofy/zamia-ai,6418859,,"Free and open source A.I. system based on Python, TensorFlow and Prolog.",,Prolog,False,False,master,124072,164,164,27,0,0,1546,1,2014-01-17 08:49:59,2025-04-19 21:11:49,2021-05-13 19:06:43
15994863,tauCharts,TargetProcess/tauCharts,649085,649085,D3 based data-focused charting library. Designed with passion. Flexible.,https://www.taucharts.com,JavaScript,False,False,master,23987,1906,1906,109,100,0,2355,531,2014-01-17 09:03:30,2025-03-12 18:00:36,2023-10-04 14:07:25
