id,name,full_name,owner_id,organization_id,description,homepage,language,private,fork,default_branch,size,stargazers_count,watchers_count,forks_count,open_issues_count,contributors_count,commits_count,pull_requests_count,created_at,updated_at,pushed_at
15558528,Nelibur,Nelibur/Nelibur,6294792,6294792,Message based webservice framework on the pure WCF,http://nelibur.org/,C#,False,False,master,3493,128,128,37,4,0,292,7,2014-01-01 00:10:44,2024-10-14 11:12:20,2018-08-15 17:40:10
15558686,temp-write,sindresorhus/temp-write,170270,,Write data to a random temporary file,,JavaScript,False,False,main,40,105,105,12,0,0,59,7,2014-01-01 00:33:26,2024-12-10 22:36:53,2024-07-26 14:22:05
15558950,checkstyle,qiniu/checkstyle,1563636,1563636,checkstyle for go,,Go,False,False,master,43,131,131,17,5,0,93,8,2014-01-01 01:09:27,2025-04-16 00:22:55,2021-03-10 02:55:53
15558959,beagleg,hzeller/beagleg,140937,,G-code interpreter and stepmotor controller for crazy fast coordinated moves of up to 8 steppers. Uses the Programmable Realtime Unit (PRU) of the Beaglebone.,http://beagleg.org/,C++,False,False,main,17338,124,124,52,12,0,996,42,2014-01-01 01:10:20,2025-03-05 13:59:00,2023-12-12 23:21:10
15559377,RedisStudio,cinience/RedisStudio,557426,,RedisStudio Redis GUI client(tool) for windows,https://github.com/cinience/RedisStudio,C++,False,False,master,10766,1549,1549,395,28,0,92,4,2014-01-01 01:59:36,2025-04-15 04:57:04,2017-04-17 10:27:47
15559571,AndroidStudio,bxiaopeng/AndroidStudio,3722923,,AndroidStudio中文入门指南,http://yuedu.baidu.com/ebook/31beb61a9b6648d7c1c746e8,Java,False,False,master,16835,511,511,254,15,0,22,0,2014-01-01 02:27:31,2025-04-22 03:10:32,2016-08-16 03:48:34
15560159,linbus,zapta/linbus,2184769,,An Arduino based LINBUS stack and signal interceptor/injector.,,Eagle,False,False,master,13720,189,189,70,30,0,233,5,2014-01-01 03:43:43,2025-03-20 17:21:31,2019-03-01 07:56:03
15560400,perfjankie,axemclion/perfjankie,17868,,Checking browser rendering performance regression ,,JavaScript,False,False,master,1756,344,344,25,6,0,155,10,2014-01-01 04:22:01,2025-02-06 01:13:13,2017-01-01 23:13:51
15560657,RSA,shaojunhan/RSA,5484739,,C++ code of 1024 rsa,,C++,False,False,master,8712,136,136,65,9,0,2,1,2014-01-01 04:59:58,2025-03-21 01:25:11,2014-01-01 05:23:00
15560790,feedopensource,dominictarr/feedopensource,259374,,Iteratively Fund Open Source Projects With Bitcoin,feedopensource.com,JavaScript,False,False,master,2023,143,143,12,11,0,176,16,2014-01-01 05:22:04,2025-03-23 10:06:22,2014-03-06 08:20:38
15561103,vim-lexical,preservim/vim-lexical,56785356,56785356,Build on Vim’s spell/thes/dict completion,,Vim script,False,False,master,25,273,273,8,10,0,45,4,2014-01-01 06:05:00,2024-12-10 22:14:04,2022-02-11 22:37:05
15561422,cwrap,h12w/cwrap,2070104,,Wraps C libraries in Go.,,Go,False,False,master,134,118,118,4,0,0,30,1,2014-01-01 06:54:29,2024-12-28 07:03:23,2023-05-18 20:42:04
15562452,backbone.controller,artyomtrityak/backbone.controller,957406,,Controller for Backbone MV*,,JavaScript,False,False,master,856,140,140,19,3,0,52,6,2014-01-01 09:17:48,2024-06-19 03:44:40,2017-04-17 06:45:45
15562877,pgexercises,AlisdairO/pgexercises,6296622,,PostgreSQL Exercises web site code,,JavaScript,False,False,master,4292,409,409,62,33,0,103,38,2014-01-01 10:22:41,2025-03-24 06:43:16,2024-05-08 06:52:42
15563029,omnipay-alipay,lokielse/omnipay-alipay,1573211,,Alipay driver for the Omnipay PHP payment processing library,,PHP,False,False,master,1416,562,562,156,23,0,559,48,2014-01-01 10:43:16,2025-03-01 14:19:16,2021-01-05 04:14:17
15563341,osmapi,metaodi/osmapi,538415,,Python wrapper for the OpenStreetMap API,http://osmapi.metaodi.ch/,Python,False,False,develop,1018,220,220,42,17,0,447,117,2014-01-01 11:23:47,2025-04-09 05:26:51,2025-01-21 09:30:24
15563684,halt,augustl/halt,375,,OS where everything is immutable! (Experimental),http://augustl.com/blog/2014/an_immutable_operating_system/,Rust,False,False,master,94,274,274,6,0,0,149,2,2014-01-01 12:00:22,2025-02-13 19:06:26,2018-12-11 20:36:16
15563865,WebPageTest.bulk-tester,catchpoint/WebPageTest.bulk-tester,740015,740015,Google App Script for spreadsheet that uses the WPT API to bulk test URLs,,JavaScript,False,False,master,38,262,262,22,11,0,25,6,2014-01-01 12:19:39,2025-04-02 16:35:02,2024-04-30 17:09:34
15564089,rust-empty,PistonDevelopers/rust-empty,7623406,7623406,A Makefile to get started with Rust (DEPRECATED),,Makefile,False,False,master,127,184,184,22,0,0,234,23,2014-01-01 12:42:10,2023-09-05 14:17:32,2018-04-02 16:50:16
15564170,euterpe,ironsmile/euterpe,50431,,Self-hosted music streaming server 🎶 with RESTful API and Web interface. Think of it as your very own Spotify! ☁️🎧,https://listen-to-euterpe.eu,Go,False,False,master,40846,552,552,43,13,0,587,20,2014-01-01 12:51:54,2025-04-21 10:14:23,2025-04-19 18:15:25
15564260,Calendar-iOS,maximbilan/Calendar-iOS,3020089,,Calendar View,,Objective-C,False,False,master,1989,164,164,22,3,0,165,9,2014-01-01 13:02:21,2024-12-18 11:57:19,2018-09-19 12:56:16
15564525,magrittr,tidyverse/magrittr,22032646,22032646,Improve the readability of R code with the pipe,https://magrittr.tidyverse.org,R,False,False,main,5330,961,961,158,26,0,323,77,2014-01-01 13:30:01,2025-03-07 23:52:11,2023-03-08 13:37:44
15564561,c99sh,RhysU/c99sh,85419,,"A shebang-friendly script for ""interpreting"" single C99, C11, and C++ files, including rcfile support.",,Shell,False,False,master,95,107,107,13,6,0,116,11,2014-01-01 13:33:18,2025-03-29 19:39:11,2024-09-29 13:09:24
15565340,composer-doc-cn,5-say/composer-doc-cn,6258835,,Composer 中文文档（新版本文档重新翻译中，详见 1.6分支）,http://www.phpcomposer.com/,,False,False,master,13781,351,351,136,2,0,133,10,2014-01-01 14:41:25,2025-04-13 03:20:56,2019-06-17 10:04:15
15566218,angular-tree-control,wix-incubator/angular-tree-control,37068588,37068588,Angular JS Tree,http://wix.github.io/angular-tree-control,HTML,False,False,master,1662,707,707,274,131,0,253,84,2014-01-01 15:52:51,2025-02-20 06:35:06,2023-03-20 12:07:53
15568174,ga-beacon,igrigorik/ga-beacon,10652,,Google Analytics collector-as-a-service (using GA measurement protocol).,,Go,False,False,master,59,3538,3538,360,8,0,68,24,2014-01-01 18:31:50,2025-04-08 14:31:40,2023-02-06 10:16:14
15568225,gulp-webp,sindresorhus/gulp-webp,170270,,Convert images to WebP,,JavaScript,False,False,main,60,220,220,18,5,0,39,9,2014-01-01 18:35:30,2025-02-22 16:52:39,2023-11-01 16:05:59
15568271,front-end-Interview-Questions,khan4019/front-end-Interview-Questions,1848375,,Help the front End community to rock interview,http://www.thatjsdude.com/interview/index.html,HTML,False,False,master,10487,2996,2996,736,24,0,423,89,2014-01-01 18:39:57,2025-04-21 07:23:31,2024-05-26 06:36:52
15568575,yii2-imagine,yiisoft/yii2-imagine,993323,993323,Yii 2 imagine extension,http://www.yiiframework.com,PHP,False,False,master,235,286,286,92,6,0,125,33,2014-01-01 19:03:46,2025-04-01 06:28:38,2023-09-29 16:09:49
15568701,pySmartDL,iTaybb/pySmartDL,3614982,,A Smart Download Manager for Python,,Python,False,False,master,692,204,204,55,23,0,76,21,2014-01-01 19:11:38,2025-04-19 22:41:11,2024-02-27 06:19:36
15569095,web-term,IonicaBizau/web-term,2864371,,:tv: A fullscreen terminal in your browser.,,JavaScript,False,False,master,2453,171,171,22,2,0,685,40,2014-01-01 19:45:35,2025-04-03 08:13:45,2025-02-14 02:04:47
15569322,jmdict-kindle,jmdict-kindle/jmdict-kindle,98088186,98088186,Japanese - English dictionary for Kindle based on the JMdict / EDICT database,,Python,False,False,main,4413,239,239,17,2,0,137,14,2014-01-01 20:02:59,2025-04-19 04:47:04,2025-02-11 15:19:19
15569324,RNPinnedCertValidator,rnapier/RNPinnedCertValidator,429858,,Simplifies validating pinned SSL certificates,http://robnapier.net/pinning-your-ssl-certs/,Objective-C,False,False,master,174,163,163,8,2,0,17,2,2014-01-01 20:03:10,2023-09-17 21:17:30,2014-01-05 19:41:58
15569400,latency,grahamking/latency,180418,,Measure network round-trip latency by sending a TCP SYN packet.,,Go,False,False,master,21,189,189,37,2,0,15,4,2014-01-01 20:08:55,2025-04-07 01:30:27,2016-03-30 16:50:50
15570122,Gooey,chriskiehl/Gooey,1408720,,Turn (almost) any Python command line program into a full GUI application with one line,,Python,False,False,master,4135,21092,21092,1030,172,0,743,302,2014-01-01 21:06:05,2025-04-22 04:00:00,2025-03-13 00:09:11
15570840,react-table-sorter-demo,bgerm/react-table-sorter-demo,75291,,A React.js Table Sorter Component,,JavaScript,False,False,master,340,108,108,16,0,0,9,0,2014-01-01 22:07:26,2022-10-10 18:43:14,2014-01-02 22:23:14
15570895,Viola-Jones,Simon-Hohberg/Viola-Jones,307004,,Python implementation of the face detection algorithm by Paul Viola and Michael J. Jones,,Python,False,False,master,31,146,146,55,8,0,13,1,2014-01-01 22:12:04,2025-04-18 02:40:00,2019-10-11 03:22:35
15570912,lenses,DrBoolean/lenses,28562,,Composable kmett style lenses,,JavaScript,False,False,master,343,214,214,13,3,0,39,6,2014-01-01 22:13:15,2024-11-14 03:13:48,2015-09-28 15:38:11
15571064,Bootstrap3-Webmin-Theme,riccardonobile/Bootstrap3-Webmin-Theme,4092574,,BWTheme - A simple and beautiful theme for Webmin and Usermin made using Bootstrap and Font Awesome,http://theme.winfuture.it/,CSS,False,False,testing,2369,199,199,57,2,0,70,15,2014-01-01 22:24:29,2025-04-02 10:19:44,2017-06-08 10:00:47
15571638,golang-tools-install-script,canha/golang-tools-install-script,470227,,Simple Bash script to automate Go language tools single user installation or even removal.,,Shell,False,False,master,103,549,549,136,7,0,150,58,2014-01-01 23:10:01,2025-04-16 09:52:08,2024-08-14 01:03:39
15571927,aria2.js,sonnyp/aria2.js,19673,,"JavaScript library for aria2, ""The next generation download utility.""",https://aria2.github.io/,JavaScript,False,False,main,492,628,628,63,9,0,173,46,2014-01-01 23:34:25,2025-04-17 02:16:03,2023-03-04 04:41:37
15571957,compression,expressjs/compression,5658226,5658226,Node.js compression middleware,,JavaScript,False,False,master,288,2789,2789,240,18,0,420,84,2014-01-01 23:38:37,2025-04-17 17:42:09,2025-04-17 05:42:51
15572115,password-validator,jeremykendall/password-validator,288613,,"Validates passwords against PHP's password_hash function using PASSWORD_DEFAULT. Will rehash when needed, and will upgrade legacy passwords with the Upgrade decorator.",,PHP,False,False,develop,73,143,143,16,4,0,60,16,2014-01-01 23:50:52,2025-02-16 04:09:58,2018-04-07 08:42:37
15572279,piracast,codemonkeyricky/piracast,1177202,,An implementation of Miracast on the Raspberry Pi. ,,C,False,False,master,23565,289,289,66,11,0,54,9,2014-01-02 00:05:58,2025-04-17 05:39:31,2014-07-17 04:40:47
15572796,Image-Select,websemantics/Image-Select,2190455,,"Image Select is an extension of Chosen, a jQuery plugin that makes long, unwieldy select boxes much more user-friendly. It provides image support for Single and Multi select HTML tags.",http://websemantics.github.io/Image-Select,HTML,False,False,master,8200,147,147,43,10,0,83,12,2014-01-02 00:54:23,2024-07-30 08:56:31,2017-05-20 14:32:37
15572966,ppp,ppp-project/ppp,76855764,76855764,Paul's PPP Package: PPP daemon and associated utilities | Official GitHub repo: https://github.com/ppp-project/ppp,https://github.com/ppp-project/ppp,C,False,False,master,6000,403,403,239,35,0,2347,323,2014-01-02 01:09:16,2025-04-22 07:36:28,2025-04-08 07:15:58
15573192,intellij-haskforce,carymrobbins/intellij-haskforce,3103764,,Haskell plugin for IntelliJ IDEA,http://carymrobbins.github.io/intellij-haskforce/,Java,False,False,master,33299,486,486,39,123,0,1243,101,2014-01-02 01:28:54,2025-03-26 14:42:12,2022-07-19 22:28:45
15574312,libmpsse,devttys0/libmpsse,5703146,,Open source library for SPI/I2C control via FTDI chips,,C,False,False,master,607,270,270,177,36,0,14,26,2014-01-02 02:45:00,2025-03-27 17:41:30,2024-08-05 10:13:53
15574516,npmsearch,nodesource/npmsearch,6759417,6759417,blazing fast npm search utility,http://npmsearch.com,JavaScript,False,False,master,813,276,276,29,0,0,64,17,2014-01-02 02:59:14,2025-01-30 21:49:01,2017-04-17 13:31:29
15575261,Seeed_Arduino_CAN,Seeed-Studio/Seeed_Arduino_CAN,688117,688117,Seeed Arduino CAN-BUS library - MCP2518FD&MCP2515&MCP2551,,C++,False,False,master,662,862,862,450,0,0,301,62,2014-01-02 03:49:28,2025-04-22 11:29:37,2025-04-21 02:22:41
15576575,ngraph,anvaka/ngraph,225407,,Beautiful Graphs,,,False,False,main,1669,1466,1466,130,22,0,257,4,2014-01-02 05:27:25,2025-04-09 17:10:57,2024-05-16 05:16:22
15577218,SpinKit-ObjC,raymondjavaxx/SpinKit-ObjC,28428,,UIKit port of SpinKit,,Objective-C,False,False,master,455,724,724,77,10,0,70,12,2014-01-02 06:16:18,2025-02-17 16:09:41,2017-06-08 08:38:15
15577314,gulp-bump,stephenlacy/gulp-bump,5648999,,Bump any version in any file which supports semver with gulp (gulpjs.com),,JavaScript,False,False,master,103,258,258,26,1,0,160,27,2014-01-02 06:22:56,2023-08-24 07:14:45,2020-06-25 03:29:36
15577851,compilebot,renfredxh/compilebot,3800339,,A bot that executes source code in reddit comments,http://reddit.com/r/CompileBot/wiki,Python,False,False,master,140,175,175,13,3,0,234,9,2014-01-02 07:00:01,2024-07-01 16:48:06,2017-12-03 02:43:19
15577868,mixer,siddontang/mixer,1080370,,a MySQL proxy powered by Go,,Go,False,False,master,1165,770,770,124,12,0,164,15,2014-01-02 07:00:57,2025-03-10 23:13:42,2019-01-21 16:06:18
15578117,campaign,bevacqua/campaign,934293,,":love_letter: Compose responsive email templates easily, fill them with models, and send them out.",https://ponyfoo.com,JavaScript,False,False,master,220,641,641,38,1,0,111,6,2014-01-02 07:16:06,2025-03-23 14:42:26,2024-03-16 02:16:41
15578315,markdown,emn178/markdown,3477613,,A markdown example shows how to write a markdown file.,,,False,False,master,204,110,110,219,0,0,13,2,2014-01-02 07:30:50,2025-04-17 16:20:58,2014-02-04 12:30:57
15578914,simple_http,maliubiao/simple_http,3348575,,a simple http library ,,Python,False,False,master,271,109,109,12,0,0,71,0,2014-01-02 08:15:50,2024-07-20 16:47:10,2017-03-27 06:36:17
15579044,Learn-Git-in-30-days,doggy8088/Learn-Git-in-30-days,88981,,這是 Will 保哥在 2013 第 6 屆 iT 邦幫忙鐵人賽年度大獎的得獎著作【30 天精通 Git 版本控管】，歡迎大家 fork 我，如果有看見任何文字勘誤，也歡迎利用 pull request 來通知我修正，謝謝！,http://doggy8088.github.io/Learn-Git-in-30-days/,,False,False,master,9180,4098,4098,2008,1,0,157,51,2014-01-02 08:24:23,2025-04-20 15:02:24,2024-12-22 13:14:37
15579485,rainbow,luochen1990/rainbow,2309868,,"Rainbow Parentheses Improved, shorter code, no level limit, smooth and fast, powerful configuration.",,Vim Script,False,False,master,657,1805,1805,97,58,0,161,36,2014-01-02 08:48:50,2025-04-17 07:03:21,2024-07-27 05:00:49
15579619,cassandra,pokle/cassandra,99655,,A Docker Cassandra container,,Shell,False,False,master,516,198,198,89,8,0,78,16,2014-01-02 08:56:02,2024-03-08 19:26:49,2021-04-28 18:06:40
15581469,cleverstack-cli,CleverStack/cleverstack-cli,6302385,6302385,CLI for CleverStack,http://youtube.com/watch?v=-4ArURHExhQ,JavaScript,False,False,master,716,196,196,32,19,0,348,9,2014-01-02 10:43:57,2023-07-11 04:12:09,2016-05-05 04:27:07
15581810,schema-inspector,schema-inspector/schema-inspector,77369772,77369772,Schema-Inspector is a simple JavaScript object sanitization and validation module.,http://schema-inspector.github.io/schema-inspector/,JavaScript,False,False,master,1937,505,505,45,1,0,170,71,2014-01-02 11:07:52,2025-04-12 23:19:40,2024-12-03 23:52:58
15582132,sailor,sailorproject/sailor,16668978,16668978,A Lua MVC Web Framework.,,Lua,False,False,master,1879,934,934,123,48,0,645,83,2014-01-02 11:29:24,2025-04-19 03:58:03,2022-10-28 09:53:01
15582353,tuareg,ocaml/tuareg,1841483,1841483,Emacs OCaml mode,,Emacs Lisp,False,False,master,1394,373,373,80,37,0,979,105,2014-01-02 11:41:38,2025-03-31 10:19:39,2025-02-28 02:57:34
15583058,Adafruit_nRF8001,adafruit/Adafruit_nRF8001,181069,181069,Drivers for Adafruit's nRF8001 Bluetooth Low Energy Breakout,,C,False,False,master,192,109,109,53,13,0,67,19,2014-01-02 12:24:43,2025-01-18 12:44:17,2020-06-26 18:54:17
15583131,pyboard,micropython/pyboard,6298560,6298560,The MicroPython board,,Eagle,False,False,master,17964,520,520,168,9,0,16,3,2014-01-02 12:29:55,2025-04-09 00:21:25,2016-01-20 00:49:44
15583310,SoftEtherVPN,SoftEtherVPN/SoftEtherVPN,6303100,6303100,Cross-platform multi-protocol VPN software. Pull requests are welcome. The stable version is available at https://github.com/SoftEtherVPN/SoftEtherVPN_Stable.,,C,False,False,master,540961,12182,12182,2647,263,0,2080,839,2014-01-02 12:40:57,2025-04-22 09:03:31,2025-04-13 22:05:51
15583369,WifiChat,hillfly/WifiChat,6228041,,An instant-messaging app based on Android,,Java,False,False,master,8782,351,351,238,5,0,54,2,2014-01-02 12:44:47,2025-04-01 08:17:17,2016-03-30 13:01:48
15583441,php-oop-fundamentals,joostvanveen/php-oop-fundamentals,540294,,This repository accompanies the Tuts+ course PHP OOP Fundamentals,,PHP,False,False,master,204,111,111,78,0,0,19,0,2014-01-02 12:48:24,2025-01-02 22:52:45,2014-01-30 23:30:34
15584172,irssi-smartfilter,lifeforms/irssi-smartfilter,3464056,,Irssi smart filter to selectively hide JOIN/QUIT in busy channels,,Perl,False,False,master,28,145,145,8,5,0,38,4,2014-01-02 13:28:10,2025-03-05 21:59:36,2016-07-17 13:28:52
15584383,flat,proycon/flat,75427,,"FoLiA Linguistic Annotation Tool -- Flat is a web-based linguistic annotation environment based around the FoLiA format (http://proycon.github.io/folia), a rich XML-based format for linguistic annotation. Flat allows users to view annotated FoLiA documents and enrich these documents with new annotations, a wide variety of linguistic annotation types is supported through the FoLiA paradigm.",,JavaScript,False,False,master,10554,112,112,15,37,0,1617,5,2014-01-02 13:38:48,2025-03-20 03:37:13,2025-01-24 15:47:58
15584449,geojson-regions,AshKyd/geojson-regions,49600,,🌏 A repo to create simplified GeoJSON regions so we can display map-based visualisations without having to load tiles all over the place.,https://geojson-maps.ash.ms/,HTML,False,False,main,52732,421,421,258,8,0,35,7,2014-01-02 13:42:30,2025-04-17 15:00:53,2024-11-12 08:14:22
15584464,the_platinum_searcher,monochromegane/the_platinum_searcher,1845486,,A code search tool similar to ack and the_silver_searcher(ag). It supports multi platforms and multi encodings.,,Go,False,False,master,1496,2813,2813,140,44,0,480,100,2014-01-02 13:43:20,2025-04-06 21:57:49,2023-08-01 10:12:42
15585322,DbExporter,nWidart/DbExporter,882397,,Export your database as a Laravel Migration. And export your DB data as a seed file. Finally sync all this with your remote server.,,PHP,False,False,master,82,379,379,84,16,0,83,17,2014-01-02 14:22:27,2025-03-30 16:01:17,2023-02-16 12:12:22
15585444,Hover,IanLunn/Hover,694641,,"A collection of CSS3 powered hover effects to be applied to links, buttons, logos, SVG, featured images and so on. Easily apply to your own elements, modify or just use for inspiration. Available in CSS, Sass, and LESS.",http://ianlunn.github.io/Hover/,SCSS,False,False,master,994,29340,29340,5762,42,0,132,67,2014-01-02 14:27:35,2025-04-22 06:54:51,2023-10-28 16:07:33
15585891,JavaScriptBridge,kishikawakatsumi/JavaScriptBridge,40610,,Write iOS apps in Javascript! JavaScriptBridge provides the way to write iOS apps with JavaScript. Powered by JavaScriptCore.framework.,http://d.hatena.ne.jp/KishikawaKatsumi/20140104/1388848644,Objective-C,False,False,master,3274,529,529,65,5,0,154,21,2014-01-02 14:47:56,2025-03-04 10:55:59,2014-03-09 12:55:25
15586256,SublimeLinter-eslint,SublimeLinter/SublimeLinter-eslint,1755200,1755200,This linter plugin for SublimeLinter provides an interface to ESLint,,Python,False,False,master,170,868,868,89,6,0,231,86,2014-01-02 15:03:38,2025-03-20 14:46:54,2025-02-27 16:36:34
15586294,nvm-fish,alex7kom/nvm-fish,181961,,"Node Version Manager for fish shell - **NO LONGER MAINTAINED, DO NOT USE** - Use https://github.com/edc/bass instead to wrap the original nvm.",,Shell,False,False,master,341,142,142,14,10,0,16,5,2014-01-02 15:05:20,2024-09-01 05:57:36,2014-08-30 11:02:50
15587441,ABAP,mauriciolauffer/ABAP,443888,,ABAP Code sample,,ABAP,False,False,master,34,172,172,50,1,0,17,1,2014-01-02 15:53:11,2025-04-01 07:41:24,2020-12-21 06:01:25
15588637,libcuckoo,efficient/libcuckoo,1855015,1855015,"A high-performance, concurrent hash table",,C++,False,False,master,5152,1653,1653,277,20,0,402,45,2014-01-02 16:50:19,2025-04-22 06:55:35,2025-03-31 16:47:49
15588695,SAMultisectorControl,husky-dev/SAMultisectorControl,1960658,,Multiple control,,Objective-C,False,False,master,286,559,559,61,6,0,14,2,2014-01-02 16:53:17,2025-04-17 01:25:15,2023-09-14 06:46:21
15589752,lasso,lasso-js/lasso,11873177,11873177,"Advanced JavaScript module bundler, asset pipeline and optimizer",,JavaScript,False,False,master,3453,585,585,74,92,0,1336,107,2014-01-02 17:48:18,2025-02-06 02:29:06,2024-04-04 22:34:48
15589826,Arduino-Libs,watterott/Arduino-Libs,1488291,1488291,"Arduino Libs & Examples: ADS1147, ADS7846, DAC8760, DS1307, RV8523, MCP2515, WS2812, S65-Display, MI0283QT-2/-9/-11, HX8347D, ILI9341, SSD1331",https://learn.watterott.com/arduino/watterott-libs/,C++,False,False,master,313,171,171,154,0,0,49,19,2014-01-02 17:51:53,2025-03-24 16:38:54,2023-12-10 10:27:28
15590153,weka,bnjmn/weka,727509,,Now redundant weka mirror. Visit https://github.com/Waikato/weka-trunk for the real deal,,Java,False,False,master,615039,326,326,249,0,0,9612,31,2014-01-02 18:08:15,2025-02-26 23:11:53,2019-04-24 21:19:09
15590229,ExpectIt,agavrilov76/ExpectIt,3617195,,Yet another Expect for Java,,Java,False,False,master,504,159,159,44,20,0,278,10,2014-01-02 18:12:20,2025-04-18 14:17:15,2019-04-09 05:50:04
15590361,tap-spec,scottcorgan/tap-spec,974723,,Formatted TAP output like Mocha's spec reporter,,JavaScript,False,False,master,77,283,283,37,12,0,94,34,2014-01-02 18:18:21,2025-01-08 04:46:03,2024-06-01 02:03:33
15591768,figlet-cli,patorjk/figlet-cli,521224,,A command line interface for the figlet.js library.,,JavaScript,False,False,main,177,126,126,24,0,0,27,11,2014-01-02 19:28:55,2025-04-13 01:35:51,2025-04-12 00:54:23
15592138,BEMSimpleLineGraph,Boris-Em/BEMSimpleLineGraph,4613643,,Elegant Line Graphs for iOS. (Charting library),,Objective-C,False,False,master,2175,2651,2651,380,49,0,319,76,2014-01-02 19:45:11,2025-04-12 10:07:16,2019-05-01 14:20:10
15592447,king-phisher,rsmusllp/king-phisher,3228981,3228981,Phishing Campaign Toolkit,,Python,False,False,master,7126,2382,2382,558,29,0,2446,127,2014-01-02 20:00:55,2025-04-22 09:33:43,2024-07-26 17:57:16
15592459,CumulusCI,SFDO-Tooling/CumulusCI,42554011,42554011,Python framework for building portable automation for Salesforce projects,http://cumulusci.readthedocs.io,Python,False,False,main,101598,373,373,247,160,0,12585,3136,2014-01-02 20:01:31,2025-04-18 17:16:33,2025-04-18 17:16:30
15592656,gulp-react,sindresorhus/gulp-react,170270,,[DEPRECATED] Precompile Facebook React JSX templates into JavaScript,,JavaScript,False,False,master,373,233,233,28,0,0,53,18,2014-01-02 20:10:32,2025-01-07 20:10:51,2015-10-15 18:16:38
15592859,antlr4ide,antlr4ide/antlr4ide,23463646,23463646,ANTLR 4 IDE for Eclipse,,Java,False,False,master,117704,207,207,115,32,0,219,32,2014-01-02 20:21:48,2025-01-22 05:41:19,2022-10-27 22:19:16
15593211,console-log-viewer,markknol/console-log-viewer,576184,,Displays logs and Javascript errors in an overlay on top of your site. Useful for mobile webdevelopment. Enabled in 5 seconds,,,False,False,master,80,126,126,9,5,0,41,0,2014-01-02 20:38:20,2025-03-26 13:45:32,2021-03-03 10:34:21
15593434,Bootstrap-Admin-Theme-3,VinceG/Bootstrap-Admin-Theme-3,195199,,A generic admin theme built with Bootstrap 3 free for both personal and commercial use. ,,CSS,False,False,master,3533,572,572,222,1,0,9,1,2014-01-02 20:47:52,2025-01-19 11:24:07,2021-11-24 10:15:12
15593603,omniwallet,OmniLayer/omniwallet,10849356,10849356,Omni Protocol Hybrid Web-Wallet,https://www.omniwallet.org,JavaScript,False,False,master,17464,332,332,190,235,0,4843,1019,2014-01-02 20:56:23,2025-04-18 13:18:03,2024-08-11 01:30:47
15594033,clink,mridgers/clink,1431672,,Bash's powerful command line editing in cmd.exe,mridgers.github.io/clink,C,False,False,master,5526,3250,3250,283,165,0,2120,39,2014-01-02 21:19:11,2025-04-15 00:34:20,2024-08-03 13:25:55
15595086,benchmarks,openalpr/benchmarks,5896442,5896442,Benchmark tests supporting the openalpr library,,Python,False,False,master,192491,107,107,87,3,0,19,1,2014-01-02 22:12:20,2025-04-20 17:38:02,2017-09-07 01:50:34
15595559,slip,kornelski/slip,72159,,Slip.js — UI library for manipulating lists via swipe and drag gestures,,JavaScript,False,False,master,97,2435,2435,213,23,0,113,47,2014-01-02 22:37:36,2025-04-08 09:26:02,2021-09-23 19:09:56
15596246,Adafruit_ILI9341,adafruit/Adafruit_ILI9341,181069,181069,Library for Adafruit ILI9341 displays,,C++,False,False,master,672,436,436,283,19,0,174,41,2014-01-02 23:17:51,2025-04-16 20:16:19,2024-08-09 20:52:05
15596399,basic,hapijs/basic,3774533,3774533,Basic authentication plugin,,JavaScript,False,False,master,99,147,147,66,0,0,125,51,2014-01-02 23:27:02,2025-01-17 20:11:06,2024-10-23 14:42:22
15596432,cookie,hapijs/cookie,3774533,3774533,Cookie authentication plugin,,JavaScript,False,False,master,284,229,229,99,7,0,247,90,2014-01-02 23:29:16,2025-03-12 13:17:03,2024-10-23 15:43:20
15596856,videojs-wavesurfer,collab-project/videojs-wavesurfer,347599,347599,video.js plugin that adds a navigable waveform for audio and video files,https://collab-project.github.io/videojs-wavesurfer,JavaScript,False,False,master,12060,370,370,56,13,0,640,81,2014-01-02 23:56:23,2025-04-14 09:00:16,2024-12-15 13:49:53
