id,name,full_name,owner_id,organization_id,description,homepage,language,private,fork,default_branch,size,stargazers_count,watchers_count,forks_count,open_issues_count,contributors_count,commits_count,pull_requests_count,created_at,updated_at,pushed_at
15719288,FCOfflineQueue,marcoarment/FCOfflineQueue,366193,,A serial iOS operation queue that pauses when offline and persists unfinished operations between launches.,,Objective-C,False,False,master,160,256,256,11,1,0,6,0,2014-01-07 23:01:47,2024-12-18 11:57:18,2014-11-02 03:34:51
15719552,The-Shell,mityalebedev/The-Shell,1761114,,Ghost Theme 👻,https://ghostintheshell.ghost.io,SCSS,False,False,master,638,447,447,134,15,0,52,28,2014-01-07 23:14:14,2025-03-31 01:29:37,2023-04-15 16:55:59
15719909,laravel-push-notification,davibennun/laravel-push-notification,1722200,,Laravel package to enable sending push notifications to devices,,PHP,False,False,master,25,1236,1236,255,113,0,32,30,2014-01-07 23:29:45,2025-04-04 15:10:38,2023-05-04 03:32:33
15720445,marko,marko-js/marko,11873696,11873696,"A declarative, HTML-based language that makes building web apps fun",https://markojs.com/,JavaScript,False,False,main,38304,13562,13562,650,18,0,6100,1586,2014-01-07 23:58:21,2025-04-22 07:04:15,2025-04-22 04:26:27
15720514,MSSlidingPanelController,SebastienMichoy/MSSlidingPanelController,6314489,,[DEPRECATED] Integrate easily a sliding panel controller mechanism in your project!,,Objective-C,False,False,master,5981,268,268,45,0,0,33,5,2014-01-08 00:02:04,2025-01-17 15:54:34,2017-09-24 15:41:16
15720872,django-rest-pandas,wq/django-rest-pandas,1863683,1863683,📊📈 Serves up Pandas dataframes via the Django REST Framework for use in client-side (i.e. d3.js) visualizations and offline analysis (e.g. Excel),https://django-rest-pandas.wq.io/,Python,False,False,main,919,1261,1261,126,9,0,207,13,2014-01-08 00:20:37,2025-04-15 15:04:29,2025-03-29 01:49:15
15721105,Stitching,fiji/Stitching,458129,458129,Fiji's Stitching plugins reconstruct big images from tiled input images.,http://imagej.net/Stitching,Java,False,False,master,981,101,101,65,40,0,392,20,2014-01-08 00:34:54,2025-03-08 22:06:36,2025-01-22 16:53:39
15721226,interpy,syrusakbary/interpy,188257,,Ruby like string interpolation #{} in Python,,Python,False,False,master,14,253,253,8,8,0,9,3,2014-01-08 00:40:48,2024-12-04 14:17:55,2017-02-12 02:08:27
15721929,vedis,symisc/vedis,4615920,,An Embedded Implementation of Redis,http://vedis.symisc.net,C,False,False,master,399,552,552,57,2,0,30,7,2014-01-08 01:20:41,2025-04-21 06:58:29,2021-11-25 21:35:48
15722026,coinbase-java,coinbase/coinbase-java,1885080,1885080,Coinbase API v1 library for Java,,Java,False,False,master,1228,152,152,98,23,0,482,86,2014-01-08 01:27:07,2025-03-05 16:34:09,2020-10-14 01:56:33
15722037,plugins,gulpjs/plugins,6200624,6200624,[Unused] Very old plugin search website,,JavaScript,False,False,master,343,281,281,88,0,0,316,114,2014-01-08 01:28:01,2025-02-06 01:13:13,2020-04-27 19:27:25
15723058,dominion,egonSchiele/dominion,97219,,A Dominion simulator in Haskell,,Haskell,False,False,master,107,111,111,11,5,0,105,5,2014-01-08 02:19:36,2025-03-03 22:48:52,2016-12-08 21:23:21
15723702,taco,max-mapper/taco,39759,,a modular deployment system for unix,,,False,False,master,463,216,216,5,5,0,62,1,2014-01-08 02:51:38,2024-10-30 01:17:45,2015-04-20 17:55:56
15724998,ModernOpenGLTutorial,BennyQBD/ModernOpenGLTutorial,1908681,,The source files from the Intro to Modern OpenGL Tutorial series,,C,False,False,master,5569,222,222,138,7,0,9,3,2014-01-08 04:06:36,2025-03-26 04:39:27,2017-08-06 18:45:58
15725489,ansible-mesos,AnsibleShipyard/ansible-mesos,6966875,6966875,Mesos Playbook for Ansible,,,False,False,master,131,168,168,101,3,0,171,60,2014-01-08 04:34:23,2025-02-21 22:20:09,2018-02-19 11:35:27
15726365,SteamWorks,KyleSanderson/SteamWorks,1184902,,Exposing SteamWorks functions to SourcePawn.,,C++,False,False,master,185,146,146,102,7,0,147,37,2014-01-08 05:23:54,2025-04-08 10:31:38,2024-05-28 05:52:19
15726391,socioboard-core,socioboard/socioboard-core,6312383,,"This is an old repo, for latest maintained version go here - https://github.com/socioboard/Socioboard-Core-3.0",http://www.socioboard.org,C#,False,False,master,311976,242,242,120,16,0,208,1,2014-01-08 05:25:17,2025-04-09 16:51:19,2017-09-18 13:07:58
15726618,deadman,upa/deadman,184632,,deadman is a curses-based host status checking application using ping,,Python,False,False,master,2578,353,353,42,4,0,101,23,2014-01-08 05:39:38,2025-04-17 01:43:31,2025-03-26 04:12:55
15726786,touchjs,Clouda-team/touchjs,7857697,7857697,Touchjs getsture library,http://touch.code.baidu.com,JavaScript,False,False,master,450,230,230,241,4,0,29,2,2014-01-08 05:49:09,2024-11-22 01:21:29,2014-08-05 09:37:40
15727581,ios-amr,guange2015/ios-amr,222455,,amr for ios.,,Objective-C,False,False,master,5853,202,202,65,0,0,19,0,2014-01-08 06:29:44,2025-02-26 06:17:34,2018-03-22 06:02:36
15727979,formerly-gabegaming.com,defaultnamehere/formerly-gabegaming.com,2187165,,Are you ready for a miracle?,http://gabegaming.com,HTML,False,False,master,5796,147,147,25,7,0,50,14,2014-01-08 06:52:00,2024-05-28 21:59:02,2021-01-26 05:37:49
15728035,cocosocket,beykery/cocosocket,1357190,,cocosocket是一个为高性能网络通信准备的底层通信框架，满足对于高性能网络通信的需求，适用于基于tcp或kcp的应用开发。,,C#,False,False,master,18829,190,190,77,3,0,38,3,2014-01-08 06:55:42,2024-11-14 03:15:45,2020-02-25 13:34:07
15728293,sandstorm,sandstorm-io/sandstorm,7479094,7479094,Sandstorm is a self-hostable web productivity suite. It's implemented as a security-hardened web app package manager.,https://sandstorm.io,JavaScript,False,False,master,20193,6840,6840,709,646,0,8207,2043,2014-01-08 07:10:33,2025-04-21 17:30:29,2024-12-17 00:21:53
15729309,basic-auth-connect,expressjs/basic-auth-connect,5658226,5658226,Basic auth middleware for node and connect,,JavaScript,False,False,master,14,132,132,27,3,0,10,10,2014-01-08 08:02:40,2025-04-01 13:52:27,2024-09-30 10:15:00
15730561,php-mongo,sokil/php-mongo,1829948,,MongoDB ODM. Part of @PHPMongoKit,http://phpmongokit.github.io/,PHP,False,False,1.0,2899,240,240,46,42,0,1470,39,2014-01-08 09:06:52,2025-04-09 20:59:21,2023-02-07 10:34:34
15730865,spack,spack/spack,25539161,25539161,"A flexible package manager that supports multiple versions, configurations, platforms, and compilers.",https://spack.io,Python,False,False,develop,224597,4626,4626,2383,3334,0,40503,40916,2014-01-08 09:22:12,2025-04-22 10:38:34,2025-04-22 10:38:29
15732086,ppnet,pixelpark/ppnet,3337728,3337728,"This service can be used to create a social network, either temporarily or permanently for a group of users",http://wiki.mediafi.org/doku.php/ficontent.common.enabler.socialnetwork,JavaScript,False,False,master,16481,118,118,19,14,0,636,9,2014-01-08 10:12:48,2024-07-25 15:08:49,2018-03-03 08:13:00
15732127,cube-sdk,liaohuqiu/cube-sdk,4088573,,"A light package for Android development, it handles loading image and network request.",http://cube-sdk.liaohuqiu.net/,Java,False,False,master,13719,1184,1184,441,47,0,267,12,2014-01-08 10:14:29,2025-04-17 03:25:55,2016-10-03 10:44:11
15732537,haskell-compiler,Marwes/haskell-compiler,957312,,A mostly functional haskell compiler written in rust,,Rust,False,False,master,851,312,312,30,1,0,368,3,2014-01-08 10:34:00,2025-04-20 04:29:38,2023-12-23 04:26:16
15733160,tardisgo,tardisgo/tardisgo,6296297,6296297,Golang->Haxe->CPP/CSharp/Java/JavaScript transpiler  ,http://tardisgo.github.io,Go,False,False,master,13946,431,431,29,5,0,297,3,2014-01-08 11:07:33,2025-02-19 19:05:39,2016-11-19 18:08:43
15733881,CSStickyHeaderFlowLayout,CSStickyHeaderFlowLayout/CSStickyHeaderFlowLayout,22146843,22146843,"UICollectionView replacement of UITableView. Do even more like Parallax Header, Sticky Section Header. Made for iOS 7.",https://medium.com/ios-apprentice/43e943e6627,Objective-C,False,False,master,1021,5033,5033,610,25,0,131,39,2014-01-08 11:40:32,2025-04-21 18:13:31,2021-07-17 09:11:42
15734378,semicolon-js,dchest/semicolon-js,52677,,Semicolon.js — the most useful JavaScript library for cargo cult programmers,,Shell,False,False,master,17,152,152,12,8,0,25,9,2014-01-08 12:08:49,2025-04-07 17:58:59,2021-05-30 12:38:40
15736280,pixlserv,MilanMisak/pixlserv,1205297,,Go server for processing and serving of images,http://reshnesh.github.io/pixlserv,Go,False,False,master,1020,340,340,26,6,0,155,7,2014-01-08 13:35:47,2025-01-27 16:12:16,2019-10-17 17:48:40
15736644,authoring-styleguide,tooling/authoring-styleguide,6271549,6271549,WIP style guide for technical content. PRs welcome.,,,False,False,master,169,124,124,11,0,0,10,1,2014-01-08 13:49:44,2024-05-23 13:44:14,2014-01-18 11:34:23
15737031,MHVideoPhotoGallery,mariohahn/MHVideoPhotoGallery,915933,,A Photo and Video Gallery ,,Objective-C,False,False,master,29049,1956,1956,349,66,0,319,52,2014-01-08 14:05:52,2025-04-21 18:13:26,2021-10-06 11:35:12
15737863,openGL-RPi-tutorial,peepo/openGL-RPi-tutorial,260305,,an introduction to using openGL on the Raspberry Pi,,C,False,False,master,1197,189,189,47,4,0,68,5,2014-01-08 14:36:05,2025-02-19 23:11:33,2020-12-28 12:01:45
15738642,dumpable,ipkn/dumpable,283960,,Serialization without any serialization codes in C++,,C++,False,False,master,300,136,136,12,0,0,37,0,2014-01-08 15:06:22,2024-12-12 05:46:35,2014-02-11 09:12:05
15738723,dictate.js,Kaljurand/dictate.js,490600,,"A small Javascript library for browser-based real-time speech recognition, which uses Recorderjs for audio capture, and a WebSocket connection to the Kaldi GStreamer server for speech recognition.",https://kaljurand.github.io/dictate.js/,JavaScript,False,False,master,233,217,217,62,14,0,43,7,2014-01-08 15:09:23,2025-03-05 16:36:16,2020-03-01 08:29:37
15739123,scala-js-actors,sjrd/scala-js-actors,535934,,Actor system for Scala.js,,Scala,False,False,master,232,100,100,16,0,0,51,2,2014-01-08 15:25:57,2023-04-09 04:06:00,2018-03-30 18:42:50
15739675,Alegreya-Sans,huertatipografica/Alegreya-Sans,12895763,12895763,"Humanist sans serif family, part of Alegreya ""super family"" www.huertatipografica.com",,Python,False,False,master,170870,116,116,20,10,0,551,7,2014-01-08 15:46:03,2024-10-28 09:17:04,2020-10-31 10:45:48
15739872,SKSTableView,sakkaras/SKSTableView,4939836,,An expandable table view.,,Objective-C,False,False,master,1531,445,445,115,41,0,16,6,2014-01-08 15:52:32,2024-10-12 12:18:35,2017-10-10 07:12:01
15740205,matomo-nodejs-tracker,matomo-org/matomo-nodejs-tracker,698038,698038,A Node.js wrapper for the Matomo (Piwik) tracking HTTP API,,JavaScript,False,False,master,494,118,118,42,12,0,102,54,2014-01-08 16:04:02,2025-01-17 11:46:47,2023-02-28 04:56:28
15741223,astray,SiENcE/astray,314346,,"Astray is a lua based maze, room and dungeon generation library for dungeon crawlers and rougelike video games",,Lua,False,False,master,35,156,156,11,0,0,20,0,2014-01-08 16:35:29,2025-04-14 04:06:46,2024-12-15 13:34:22
15741676,NOTTaskPaperForIOS,jessegrosjean/NOTTaskPaperForIOS,21868,,Source code for the original TaskPaper for iOS.,,Objective-C,False,False,master,5260,498,498,85,2,0,8,2,2014-01-08 16:52:52,2025-02-22 13:15:40,2014-02-05 16:18:58
15742370,WebsiteOne,AgileVentures/WebsiteOne,5116968,5116968,A website for Agile Ventures,https://www.agileventures.org,Ruby,False,False,develop,235979,143,143,246,14,0,5282,2353,2014-01-08 17:20:22,2024-04-06 12:36:38,2024-04-27 18:56:32
15742948,wildfire.vim,gcmt/wildfire.vim,275202,,Smart selection of the closest text object,,Vim Script,False,False,master,256,609,609,19,0,0,141,10,2014-01-08 17:43:32,2025-03-16 03:31:57,2023-07-22 04:40:37
15743069,gulp-notify,mikaelbr/gulp-notify,606374,,"gulp plugin to send messages based on Vinyl Files or Errors to Mac OS X, Linux or Windows using the node-notifier module. Fallbacks to Growl or simply logging",,JavaScript,False,False,master,1164,591,591,40,36,0,238,32,2014-01-08 17:48:41,2025-04-13 14:12:51,2024-09-10 18:46:57
15743258,choroplethr,trulia/choroplethr,538589,538589,choroplethr simplifies the creation of choropleths (thematic maps) in R,,R,False,False,master,24144,141,141,53,7,0,462,16,2014-01-08 17:56:50,2025-03-22 08:14:48,2018-05-30 21:53:45
15743523,TiddlyDesktop,TiddlyWiki/TiddlyDesktop,79505,79505,"A custom desktop browser for TiddlyWiki 5 and TiddlyWiki Classic, based on nw.js",,JavaScript,False,False,master,3292,1784,1784,125,143,0,375,40,2014-01-08 18:08:31,2025-04-22 03:49:33,2025-04-14 17:20:22
15744932,ProvisionQL,ealeksandrov/ProvisionQL,3132438,,Quick Look plugin for mobile apps and provisioning profiles,,Objective-C,False,False,master,2948,2383,2383,156,8,0,98,18,2014-01-08 18:59:11,2025-04-20 08:01:35,2024-11-24 19:04:38
15745219,joda-time-android,dlew/joda-time-android,514850,,Joda-Time library with Android specialization,,Java,False,False,main,4047,2629,2629,183,3,0,538,188,2014-01-08 19:11:09,2025-04-06 00:52:15,2025-03-28 02:46:34
15745985,mywind,dalers/mywind,1334368,,MySQL version of Northwind demo database,,,False,False,master,583,370,370,495,1,0,18,1,2014-01-08 19:40:29,2025-04-14 13:40:42,2024-05-22 23:33:43
15746395,BetterTweetDeck,eramdam/BetterTweetDeck,1409924,,A browser extension to improve TweetDeck with a lot of features,https://better.tw,TypeScript,False,False,main,60774,1108,1108,117,1,0,2501,293,2014-01-08 19:57:09,2025-04-19 13:48:10,2023-07-18 23:34:22
15746706,d3-process-map,nylen/d3-process-map,227022,,Web application to illustrate the relationships between objects in a process using d3.js.,,PHP,False,False,master,1467,415,415,191,9,0,16,3,2014-01-08 20:09:49,2025-01-31 10:37:03,2017-06-29 09:15:37
15746765,glimmr,brk3/glimmr,802125,,Fully featured Flickr app for Android,,Java,False,False,master,19650,100,100,18,14,0,511,2,2014-01-08 20:12:03,2025-02-06 00:38:59,2015-08-27 14:10:32
15747034,tkd,nomad-software/tkd,1413497,,GUI toolkit for the D programming language based on Tcl/Tk,,D,False,False,master,3890,118,118,16,6,0,248,14,2014-01-08 20:23:11,2024-11-11 00:53:19,2021-10-15 16:40:59
15747622,PSPDFTextView,steipete/PSPDFTextView,58493,,A subclass of UITextView that fixes the most glaring problems from iOS 7 and 7.1.,http://pspdfkit.com,Objective-C,False,False,master,3449,871,871,73,10,0,39,9,2014-01-08 20:46:07,2025-04-04 16:59:31,2015-12-28 17:28:59
15747624,matchmedia-ng,AnalogJ/matchmedia-ng,891875,,matchmedia wrapper for angularjs,http://analogj.github.io/matchmedia-ng/,JavaScript,False,False,master,40,135,135,24,1,0,52,15,2014-01-08 20:46:14,2025-01-14 13:38:51,2017-04-17 15:24:53
15748584,Microchip,mentatpsi/Microchip,1183961,,Microchip's PIC MCU Library,,C,False,False,master,244965,106,106,147,0,0,1,2,2014-01-08 21:26:06,2025-04-12 02:16:40,2019-04-09 16:23:17
15748692,leonardo,prfalken/leonardo,334048,,Dashboard for Graphite,,JavaScript,False,False,master,2288,108,108,15,10,0,139,33,2014-01-08 21:30:00,2025-02-24 19:23:04,2021-05-22 21:36:14
15749269,google-api-python-client,googleapis/google-api-python-client,16785467,16785467,🐍 The official Python client library for Google's discovery based APIs.,https://googleapis.github.io/google-api-python-client/docs/,Python,False,False,main,479864,8158,8158,2459,155,0,1863,1392,2014-01-08 21:55:56,2025-04-22 07:40:37,2025-04-22 07:41:36
15749398,johnhenry,derwiki/johnhenry,155087,,,,Ruby,False,False,master,825,110,110,7,9,0,91,4,2014-01-08 22:15:11,2025-03-29 20:52:48,2016-02-27 21:35:49
15749731,flake-idgen,T-PWK/flake-idgen,2621535,,"Flake ID generator yields k-ordered, conflict-free ids in a distributed environment in Node.js",https://www.npmjs.org/package/flake-idgen,JavaScript,False,False,master,152,244,244,20,4,0,83,5,2014-01-08 22:26:33,2025-03-25 16:51:41,2023-01-09 05:43:17
15750659,cordova-tutorial,ccoenraets/cordova-tutorial,384156,,Cordova Tutorial,,JavaScript,False,False,master,8005,322,322,154,14,0,12,6,2014-01-08 22:58:28,2024-11-17 02:00:21,2015-09-15 17:23:13
15750847,pact-jvm,pact-foundation/pact-jvm,14811176,14811176,"JVM version of Pact. Enables consumer driven contract testing, providing a mock service and DSL for the consumer project, and interaction playback and verification for the service provider project.",https://docs.pact.io,Kotlin,False,False,master,17416,1098,1098,483,374,0,5029,453,2014-01-08 23:07:11,2025-04-22 10:32:50,2025-03-16 23:03:08
15751407,gulp-vulcanize,sindresorhus/gulp-vulcanize,170270,,Concatenate a set of Web Components into one file,,JavaScript,False,False,main,29,100,100,24,0,0,52,23,2014-01-08 23:32:12,2025-01-07 20:10:51,2021-01-23 12:02:52
15751442,clmtools,auduno/clmtools,1588066,,tools for building face-models for clmtrackr,,JavaScript,False,False,master,1566,146,146,56,10,0,42,3,2014-01-08 23:33:57,2024-11-22 01:18:16,2017-04-27 20:31:41
15751456,DLWidgetMenu,regexident/DLWidgetMenu,138017,,Versatile solution for displaying widget menus. Easily adjustable with custom layouts and/or animations.,,Objective-C,False,False,master,2482,410,410,46,1,0,17,3,2014-01-08 23:34:19,2024-06-13 09:46:13,2017-02-14 16:38:20
15753049,yii2-scroll-pager,kop/yii2-scroll-pager,645148,,Infinite AJAX scrolling for Yii2 ListView widget,https://kop.github.io/yii2-scroll-pager/,PHP,False,False,master,167,179,179,63,47,0,109,21,2014-01-09 01:03:14,2025-01-29 19:32:44,2023-12-08 08:28:50
15753295,light-haskell,jetaggart/light-haskell,161737,,Haskell plugin for LightTable,,JavaScript,False,False,master,973,114,114,12,22,0,173,14,2014-01-09 01:18:16,2023-04-08 09:33:30,2015-06-17 23:57:44
15753348,django-swappable-models,openwisp/django-swappable-models,1150243,1150243,Swapper - The unofficial Django swappable models API. Maintained by the OpenWISP project.,http://openwisp.org,Python,False,False,master,77,237,237,31,0,0,107,34,2014-01-09 01:21:15,2025-04-02 21:47:27,2025-04-02 21:47:30
15753847,ntpclient,lettier/ntpclient,1661343,,NTP client.,,C,False,False,master,52,146,146,71,7,0,3,3,2014-01-09 01:49:00,2025-03-23 07:57:29,2021-05-07 13:46:14
15754022,jellyreader,NimbusBase/jellyreader,2739120,2739120,RSS reader,jellyreader.com,CSS,False,False,gh-pages,2701,244,244,26,5,0,28,1,2014-01-09 01:58:38,2024-12-18 01:55:40,2014-07-14 05:14:18
15754563,droplet,droplet-editor/droplet,12835604,12835604,Block language reenvisioned as a text editor,http://droplet-editor.github.io,JavaScript,False,False,master,31032,227,227,85,41,0,1489,195,2014-01-09 02:27:23,2025-01-01 17:26:20,2025-04-09 14:31:12
15755057,models,sunspec/models,6342368,6342368,SunSpec Model Definitions,,Python,False,False,master,903,104,104,59,32,0,255,84,2014-01-09 02:54:55,2025-04-12 05:48:03,2024-12-10 18:42:43
15756093,RendezvousHash,clohfink/RendezvousHash,1127460,,Rendezvous or Highest Random Weight (HRW) hashing algorithm,,Java,False,False,master,264,196,196,45,0,0,20,1,2014-01-09 03:53:26,2025-03-12 11:21:13,2015-05-05 14:08:24
15756427,escpos-php,mike42/escpos-php,2080552,,PHP library for printing to ESC/POS-compatible thermal and impact printers,,PHP,False,False,development,1723,2631,2631,871,524,0,510,137,2014-01-09 04:14:38,2025-04-18 01:43:40,2024-02-10 23:40:33
15756618,pydy-tutorial-human-standing,pydy/pydy-tutorial-human-standing,5125293,5125293,"PyDy tutorial materials for MASB 2014, PYCON 2014, and SciPy 2014/2015.",http://pydy.org,Jupyter Notebook,False,False,master,3693,161,161,72,19,0,195,43,2014-01-09 04:26:48,2025-01-07 09:01:10,2023-08-14 12:30:06
15756855,b374k,b374k/b374k,4357382,,PHP Webshell with handy features,,CSS,False,False,master,1873,2462,2462,747,20,0,45,10,2014-01-09 04:43:32,2025-04-19 20:53:59,2023-07-06 20:23:03
15757031,Fleece,fsprojects/Fleece,6001315,6001315,Json mapper for F#,http://fsprojects.github.io/Fleece,F#,False,False,master,1956,200,200,30,25,0,241,88,2014-01-09 04:56:36,2025-03-10 21:01:39,2023-10-22 16:32:33
15757388,alfred-translate,podgorniy/alfred-translate,358975,,Smooth ru-en en-ru translation workflow,,Python,False,False,master,359,157,157,7,0,0,4,5,2014-01-09 05:19:10,2024-10-11 13:48:42,2022-06-17 10:40:48
15758162,gulp-debug,sindresorhus/gulp-debug,170270,,Debug Vinyl file streams to see what files are run through your Gulp pipeline,,JavaScript,False,False,main,79,221,221,29,1,0,51,15,2014-01-09 06:06:38,2025-01-07 20:10:51,2023-11-03 08:41:43
15758326,yajsync,perlundq/yajsync,3360136,,A Java implementation of the rsync protocol,,Java,False,False,master,1129,142,142,38,10,0,229,14,2014-01-09 06:16:40,2025-04-16 13:51:39,2020-06-25 13:59:03
15758533,loopback-sdk-angular,strongloop/loopback-sdk-angular,3020012,3020012,Service for auto-generating Angular $resource services for LoopBack,,JavaScript,False,False,master,339,153,153,82,4,0,326,128,2014-01-09 06:28:10,2025-03-27 18:22:40,2020-03-06 16:24:09
15758931,bip32.github.io,bip32/bip32.github.io,6356723,,BIP32 is a Brainwallet-based implementation for BIP0032 deterministic wallet generation,,JavaScript,False,False,master,445,117,117,71,11,0,302,9,2014-01-09 06:50:32,2025-03-19 18:52:28,2022-05-13 15:31:33
15759696,Everpix-Intelligence,everpix/Everpix-Intelligence,3429198,3429198,"Uncensored Everpix metrics, financials and business data for your perusing",http://www.everpix.com,,False,False,master,303138,2452,2452,533,1,0,74,3,2014-01-09 07:29:57,2025-03-16 19:05:54,2022-11-19 02:42:26
15759965,jasmine-react,tommyh/jasmine-react,348581,,Unit test your React.js applications with Jasmine,,JavaScript,False,False,master,697,226,226,22,7,0,30,10,2014-01-09 07:43:59,2025-02-06 14:41:49,2018-06-24 08:53:52
15761111,distpicker,fengyuanchen/distpicker,3456749,,"⚠️ [Deprecated] No longer maintained. A simple jQuery plugin for picking provinces, cities and districts of China. (中国 / 省市区 / 三级联动 / 地址选择器)",https://fengyuanchen.github.io/distpicker/,JavaScript,False,False,master,898,1638,1638,460,3,0,154,18,2014-01-09 08:37:07,2025-03-17 02:30:43,2023-01-01 10:54:31
15761494,JLink_ARM-OB,KitSprout/JLink_ARM-OB,7949636,7949636,ARM Cortex-M JLink 燒錄器,https://github.com/KitSprout/JLink_ARM-OB/,,False,False,master,9981,118,118,66,0,0,24,1,2014-01-09 08:53:34,2024-03-18 08:22:11,2021-01-03 06:55:48
15762693,verovio,rism-digital/verovio,68003193,68003193,"🎵 Music notation engraving library for MEI with MusicXML and Humdrum support and various toolkits (JavaScript, Python)",https://www.verovio.org,C++,False,False,develop,91967,725,725,191,175,0,15951,2039,2014-01-09 09:44:10,2025-04-22 11:19:07,2025-04-22 11:59:13
15763036,bible_databases,scrollmapper/bible_databases,6357374,,Bible versions and cross-reference databases.,,Python,False,False,master,2232583,1204,1204,388,5,0,166,36,2014-01-09 09:59:21,2025-04-22 03:35:55,2025-02-23 19:54:10
15763081,fmx163,piglei/fmx163,731266,,一个简单的Chrome插件来帮助你轻松享受高品质的豆瓣FM,,JavaScript,False,False,master,477,127,127,18,7,0,47,3,2014-01-09 10:01:23,2024-07-05 02:19:00,2016-05-15 12:11:35
15763403,OpenMS,OpenMS/OpenMS,5994841,5994841,The codebase of the OpenMS project,https://www.openms.de,C++,False,False,develop,652540,506,506,354,689,0,34308,4598,2014-01-09 10:15:13,2025-04-22 09:16:10,2025-04-22 09:16:07
15764361,lua-parser,andremm/lua-parser,3384432,,A Lua 5.3 parser written with LPegLabel,,Lua,False,False,main,100,200,200,29,3,0,71,9,2014-01-09 11:04:57,2025-04-21 05:44:39,2025-03-11 15:35:22
15764568,python-redmine,maxtepkeev/python-redmine,3032449,,Python Redmine is a library for communicating with a Redmine project management application,,Python,False,False,master,1985,557,557,119,12,0,671,41,2014-01-09 11:14:13,2025-03-28 10:28:41,2024-12-08 10:03:31
15764776,cdn,olebedev/cdn,848535,,[abandoned] Content Delivery Network on the top of MongoDb GridFs with on-the-fly image crop/resize ,,Go,False,False,master,326,134,134,29,4,0,41,1,2014-01-09 11:24:49,2025-04-17 17:05:41,2016-08-16 02:03:40
15765320,TWRProgressView,chasseurmic/TWRProgressView,1525833,,A custom progress view to be used with masking images.,,Objective-C,False,False,master,178,380,380,39,3,0,8,2,2014-01-09 11:53:00,2025-02-21 15:47:08,2015-03-23 13:57:44
15765813,grounded,alejolp/grounded,157891,,A small platform game.,,Java,False,False,master,643,167,167,29,1,0,30,2,2014-01-09 12:15:43,2024-12-25 15:03:55,2020-10-01 04:16:54
15766166,TheSidebarController,jondanao/TheSidebarController,110116,,"A container view controller that implements different popular sidebar view controllers like Facebook, Airbnb, Flipboard, etc.",,Objective-C,False,False,master,6212,358,358,50,12,0,33,6,2014-01-09 12:30:02,2025-04-04 16:58:18,2016-02-13 04:06:59
15766230,nq-agent,nodequery/nq-agent,6061940,,The NodeQuery agent collects selected linux server data and sends them to our monitoring system for further processing.,https://nodequery.com,Shell,False,False,master,253,294,294,125,16,0,15,8,2014-01-09 12:33:53,2025-04-15 17:14:57,2022-01-04 12:52:50
15766264,Laravel-Flysystem,GrahamCampbell/Laravel-Flysystem,2829600,,A Flysystem bridge for Laravel,https://gjcampbell.co.uk,PHP,False,False,8.0,676,481,481,88,0,0,534,51,2014-01-09 12:35:17,2025-03-15 20:58:55,2022-05-30 21:41:42
15766529,webpack-stream,shama/webpack-stream,99604,,:tropical_drink: Run webpack through a stream interface,,JavaScript,False,False,master,231,1394,1394,122,55,0,267,85,2014-01-09 12:47:59,2025-03-15 20:58:55,2021-11-07 21:22:02
15767202,php-buildpack,cloudfoundry/php-buildpack,621746,621746,A Cloud Foundry Buildpack for PHP.,,Python,False,False,master,67361,142,142,347,24,0,3529,773,2014-01-09 13:19:03,2025-04-10 01:57:19,2025-04-21 21:31:32
15767484,clj-fuzzy,Yomguithereal/clj-fuzzy,2571951,,A handy collection of algorithms dealing with fuzzy strings and phonetics.,http://yomguithereal.github.io/clj-fuzzy/,Clojure,False,False,master,780,265,265,26,5,0,157,6,2014-01-09 13:31:52,2025-04-13 02:05:10,2023-06-19 05:27:27
