id,name,full_name,owner_id,organization_id,description,homepage,language,private,fork,default_branch,size,stargazers_count,watchers_count,forks_count,open_issues_count,contributors_count,commits_count,pull_requests_count,created_at,updated_at,pushed_at
16189175,backbone.supermodel,tanqhnguyen/backbone.supermodel,910024,,An improved Backbone.Model with a bunch of extra features,,JavaScript,False,False,master,403,100,100,2,0,0,57,5,2014-01-23 23:25:15,2024-01-17 02:31:35,2015-04-28 19:58:08
16189524,newts,OpenNMS/newts,2972482,2972482,New-fangled Timeseries Data Store,,Java,False,False,main,6699,194,194,39,33,0,902,215,2014-01-23 23:39:27,2024-08-06 06:34:33,2024-07-22 04:42:25
16189541,csv-write-stream,max-mapper/csv-write-stream,39759,,A CSV encoder stream that produces properly escaped CSVs,,JavaScript,False,False,master,33,204,204,37,16,0,56,26,2014-01-23 23:40:52,2025-02-05 02:35:22,2020-09-02 09:01:29
16189872,bionode,bionode/bionode,6466584,6466584,Modular and universal bioinformatics,bionode.io,JavaScript,False,False,master,713,313,313,39,15,0,92,14,2014-01-23 23:56:56,2025-03-04 10:53:07,2019-11-19 13:26:33
16190186,Mft2Csv,jschicht/Mft2Csv,6486883,,Extract $MFT record info and log it to a csv file.,,AutoIt,False,False,master,20148,269,269,30,3,0,52,1,2014-01-24 00:10:50,2025-04-15 13:54:35,2024-10-07 19:53:07
16190589,clearskies_core,larroy/clearskies_core,928489,,"Open source, distributed, secure data synchronization using the clearskies protocol",,C++,False,False,master,6416,135,135,15,11,0,453,24,2014-01-24 00:32:02,2025-01-25 20:32:26,2015-02-24 13:52:25
16190750,syntax-highlight,evnbr/syntax-highlight,1024086,,Alternative syntax highlighting —,https://medium.com/p/3a6db2743a1e,JavaScript,False,False,gh-pages,249,424,424,25,7,0,20,5,2014-01-24 00:41:17,2025-04-01 18:56:11,2018-04-21 10:56:29
16191061,OverFeat,sermanet/OverFeat,1074537,,,,C,False,False,master,20011,596,596,202,34,0,26,4,2014-01-24 00:59:38,2025-04-05 01:34:31,2014-08-12 17:38:21
16191766,python-altium,vadmium/python-altium,1024659,,"Altium schematic format documentation, SVG converter and TK viewer",,Python,False,False,master,279,180,180,46,5,0,266,12,2014-01-24 01:39:42,2025-04-17 09:19:20,2022-11-24 19:34:55
16192292,Marlin,RichCattell/Marlin,6311083,,Marlin Delta firmware with autocalibration updates,,C++,False,False,master,1435,139,139,145,39,0,35,18,2014-01-24 02:06:09,2024-07-02 09:48:03,2016-01-12 18:48:16
16192306,interview-resources,davidhampgonsalves/interview-resources,178893,,long list of resources for preparing for technical computer engineering interviews,,,False,False,master,4,440,440,110,0,0,7,3,2014-01-24 02:07:08,2025-04-09 13:39:05,2017-08-31 11:46:32
16194084,Overmix,spillerrec/Overmix,2292170,,Automatic anime screenshot stitching in high quality,http://spillerrec.dk/category/software/programs/overmix/,C++,False,False,master,2453,204,204,14,61,0,896,3,2014-01-24 03:37:14,2025-03-25 16:30:13,2024-05-16 18:32:02
16194136,Pandas.jl,JuliaPy/Pandas.jl,22030672,22030672,A Julia front-end to Python's Pandas package.,,Julia,False,False,main,146,173,173,25,4,0,186,53,2014-01-24 03:39:29,2025-03-13 03:30:02,2023-10-29 01:25:43
16194216,pycoinnet,richardkiss/pycoinnet,5336,,"Python code that speaks the Bitcoin protocol, for use with pycoin",,Python,False,False,master,403,117,117,56,4,0,45,3,2014-01-24 03:43:42,2025-02-14 20:30:03,2022-03-20 16:04:56
16194327,magic-of-css,adamschwartz/magic-of-css,154613,,A CSS course to turn you into a magician.,https://adamschwartz.co/magic-of-css,CSS,False,False,gh-pages,3865,6661,6661,415,10,0,389,20,2014-01-24 03:50:52,2025-04-22 06:54:43,2022-09-24 17:12:46
16194705,iter,bradfitz/iter,2621,,"Range over integers [0,n). Seriously, that's it.",http://godoc.org/github.com/bradfitz/iter,Go,False,False,master,3,297,297,12,0,0,4,4,2014-01-24 04:11:58,2025-03-04 11:03:55,2019-12-30 17:51:10
16194739,matplotlib-gallery,rasbt/matplotlib-gallery,5618407,,Examples of matplotlib codes and plots,,Jupyter Notebook,False,False,master,20296,1199,1199,301,1,0,129,5,2014-01-24 04:13:52,2025-04-08 00:55:33,2020-10-01 10:33:31
16195085,ngSocket,angular/ngSocket,139426,139426,WebSocket support for angular,,JavaScript,False,False,master,326,202,202,25,15,0,32,17,2014-01-24 04:35:50,2025-03-04 11:03:51,2015-06-26 05:42:26
16195176,grunt-image,1000ch/grunt-image,1800018,,"Optimize PNG, JPEG, GIF, SVG images with grunt task.",http://bit.ly/we-should-optimize-images  ,JavaScript,False,False,main,3150,204,204,20,18,0,303,99,2014-01-24 04:41:40,2024-09-26 21:11:16,2023-01-07 04:44:03
16195328,minipro,vdudouyt/minipro,1840936,,An open source program for controlling the MiniPRO TL866xx series of chip programmers,,,False,False,master,511,394,394,77,0,0,231,65,2014-01-24 04:50:03,2025-03-30 18:17:44,2019-02-27 06:42:51
16196446,cortex,mquan/cortex,138784,,An immutable data store for managing deeply nested structure with React,,JavaScript,False,False,master,412,1057,1057,49,2,0,188,40,2014-01-24 05:57:09,2025-03-04 10:54:11,2018-02-20 10:20:21
16196540,Go-Package-Store,shurcooL/Go-Package-Store,41136041,41136041,An app that displays updates for the Go packages in your GOPATH.,,Go,False,False,main,14707,897,897,28,7,0,288,32,2014-01-24 06:02:09,2025-04-17 02:20:43,2023-11-26 05:18:51
16196561,st-theme-freesia,nilium/st-theme-freesia,44962,,Freesia theme for Sublime Text 3. (Unmaintained.),,JavaScript,False,False,master,5850,106,106,8,1,0,71,0,2014-01-24 06:03:09,2024-04-11 23:32:03,2015-02-15 18:34:45
16196823,sleepy,dougblack/sleepy,942395,,rest for go,,Go,False,False,master,1462,673,673,52,10,0,64,21,2014-01-24 06:20:44,2025-04-20 02:56:09,2017-11-26 18:15:34
16197043,i3ipc-glib,altdesktop/i3ipc-glib,54474812,54474812,A C interface library to i3wm,,C,False,False,master,223,104,104,18,11,0,183,15,2014-01-24 06:36:44,2024-11-17 23:11:29,2023-07-13 08:08:30
16197184,rpi-mjpg-streamer,meinside/rpi-mjpg-streamer,185988,,Instructions and helper scripts for running mjpg-streamer on Raspberry Pi,,HTML,False,False,master,34,103,103,31,0,0,32,2,2014-01-24 06:45:12,2025-01-17 20:48:37,2023-03-05 23:59:30
16198059,PagedScrollView,Navimark/PagedScrollView,4392747,,"auto silde scrollview,manual timer control,module-designed",,Objective-C,False,False,master,129,163,163,33,5,0,23,1,2014-01-24 07:34:23,2024-08-09 01:40:12,2024-02-23 04:37:28
16198698,jquery-easy-ticker,vaakash/jquery-easy-ticker,299561,,"jQuery easy ticker is a news ticker like plugin, which scrolls the list infinitely. It is highly customizable, flexible with lot of features and works in all browsers.",,HTML,False,False,master,174,216,216,106,9,0,13,10,2014-01-24 08:10:49,2025-03-19 21:52:32,2022-12-06 15:14:43
16198930,jquery,gopherjs/jquery,6654647,6654647,GopherJS Bindings for jQuery,,JavaScript,False,False,master,1398,104,104,18,3,0,99,16,2014-01-24 08:23:13,2025-02-08 00:25:12,2019-10-17 08:33:24
16200244,razr,pagekit/razr,510472,510472,Razr - The powerful PHP template engine,,PHP,False,False,master,384,134,134,20,4,0,17,1,2014-01-24 09:29:07,2024-11-21 07:48:15,2014-07-26 10:34:04
16200907,documentation,xaionaro/documentation,2349376,,Any documentation,,Makefile,False,False,master,1236,126,126,11,0,0,24,0,2014-01-24 09:56:54,2025-04-15 07:05:13,2025-03-07 12:50:51
16201059,state-of-the-union,PhpFriendsOfDdd/state-of-the-union,6490378,6490378,Describes various php Domain Driven Development initiatives all around the universe,,,False,False,master,54,925,925,68,5,0,65,22,2014-01-24 10:03:53,2025-03-05 20:49:01,2020-07-01 09:17:47
16201887,seeks,beniz/seeks,3530657,,Seeks is a decentralized p2p websearch and collaborative tool.,,C++,False,False,master,7076,278,278,52,21,0,2033,2,2014-01-24 10:44:19,2025-03-13 06:35:54,2015-05-23 18:14:36
16202089,marlin-renderer,bourgesl/marlin-renderer,5607073,,Marlin is the FAST Java2D antialiasing rasterizer derived from OpenJDK Pisces (shape),,Java,False,False,master,5142,185,185,17,12,0,68,3,2014-01-24 10:56:18,2025-03-31 06:40:58,2025-03-23 09:01:20
16202183,kateglo,ivanlanin/kateglo,15313,,"Indonesian dictionary, thesaurus, and glossary application",http://kateglo.com,PHP,False,False,master,948,120,120,37,4,0,8,0,2014-01-24 11:01:21,2025-01-20 18:27:14,2014-05-31 16:21:02
16203028,phaser-state-transition,cristianbote/phaser-state-transition,3405161,,State transition plugin for Phaser.js,,JavaScript,False,False,master,393,175,175,24,3,0,70,14,2014-01-24 11:49:29,2024-07-02 09:34:41,2020-01-02 17:58:40
16204780,wiki,rumpkernel/wiki,6481016,6481016,Wiki for rump kernels,,,False,False,master,2452,461,461,24,6,0,27,3,2014-01-24 13:12:44,2024-10-24 20:29:39,2023-07-15 13:13:20
16204921,rboy,mvdnes/rboy,1009841,,A Gameboy Emulator in Rust,,Rust,False,False,main,561,623,623,45,1,0,513,14,2014-01-24 13:17:58,2025-04-20 11:20:24,2025-04-13 05:43:34
16204923,HorizontalPicker,blazsolar/HorizontalPicker,613514,,Android widget allowing user to select one item from set of them by swiping left and right.,http://blaz.solar/HorizontalPicker,Java,False,False,develop,576,227,227,81,33,0,91,13,2014-01-24 13:18:02,2024-10-18 14:34:43,2017-12-07 17:47:56
16207494,django-websocket-request,blimpllc/django-websocket-request,1227237,1227237,Support for Django's request/response lifecycle to automatically handle WebSocket messages.,,Python,False,False,master,187,180,180,9,1,0,15,0,2014-01-24 14:57:03,2024-11-28 16:28:40,2014-09-23 20:39:24
16207608,cpustats,takke/cpustats,73930,,CPU Stats is a simple tool for android that displaying usage details of cpu within statusbar,https://play.google.com/store/apps/details?id=jp.takke.cpustats,Kotlin,False,False,master,7899,138,138,25,16,0,271,50,2014-01-24 15:01:09,2025-04-21 09:57:22,2024-10-21 07:39:49
16207704,html-loader,webpack-contrib/html-loader,25012217,25012217,HTML Loader,,JavaScript,False,False,master,4246,1171,1171,206,6,0,370,313,2014-01-24 15:04:35,2025-04-07 08:38:47,2025-01-21 17:28:34
16207874,pattern-library,alistapart/pattern-library,2035942,2035942,The ALA Pattern Library.,http://patterns.alistapart.com/,HTML,False,False,master,548,328,328,42,50,0,95,72,2014-01-24 15:11:47,2024-02-19 21:40:10,2024-09-06 10:02:42
16208003,avuik,meerita/avuik,1986585,,Android Vector Universal Interface Kit,,,False,False,master,39548,135,135,9,0,0,35,3,2014-01-24 15:16:10,2023-01-05 23:53:52,2014-05-18 16:47:53
16208904,cgroupfs-mount,tianon/cgroupfs-mount,161631,,"Simple (outdated) scripts to mount the cgroupfs (v1) hierarchy, especially structured for Debian packaging",,Shell,False,False,master,52,202,202,157,6,0,49,9,2014-01-24 15:50:21,2025-02-19 05:41:25,2022-05-31 22:06:59
16209548,apk-icon-editor,kefir500/apk-icon-editor,3617499,,"APK editor to easily change APK icons, name and version.",https://qwertycube.com/apk-icon-editor/,C++,False,False,master,139408,167,167,46,11,0,716,8,2014-01-24 16:13:16,2025-04-12 20:21:56,2020-05-16 19:10:09
16210279,javaapiforkml,urbancamo/javaapiforkml,114889,,The objective of the Java API for KML is to provide Java interfaces for easy access to KML (Keyhole Markup Language) data.,https://github.com/urbancamo/javaapiforkml/wiki,Java,False,False,master,1082,153,153,74,7,0,84,28,2014-01-24 16:41:56,2025-04-11 08:13:42,2025-04-11 08:13:38
16210283,mondrian,artursapek/mondrian,897596,,Web-based vector graphics editor,,CoffeeScript,False,False,master,1666,1241,1241,106,21,0,164,16,2014-01-24 16:42:05,2025-03-06 13:39:40,2017-10-30 03:18:15
16211818,mcrouter,facebook/mcrouter,69631,69631,Mcrouter is a memcached protocol router for scaling memcached deployments.,,C++,False,False,main,33603,3282,3282,541,112,0,2924,152,2014-01-24 17:42:42,2025-04-18 07:45:58,2025-04-21 15:03:28
16213024,rc,rakitzis/rc,5665770,,rc shell -- independent re-implementation for Unix of the Plan 9 shell (from circa 1992),,C,False,False,master,585,282,282,27,10,0,659,38,2014-01-24 18:31:00,2025-04-20 18:45:25,2024-08-25 23:50:34
16213441,qucs,Qucs/qucs,5776398,5776398,Qucs Project official mirror,http://qucs.sourceforge.net/,C++,False,False,develop,77264,1202,1202,214,86,0,3758,616,2014-01-24 18:48:36,2025-04-15 13:00:16,2025-04-22 00:31:13
16214793,gcc-plugins,rofirrim/gcc-plugins,1222352,,Experiments with the gcc plugin mechanism,,C++,False,False,master,51,109,109,25,0,0,27,2,2014-01-24 19:39:52,2025-04-06 21:18:38,2023-12-16 16:15:43
16216598,websocket,morozovsk/websocket,1822063,,simple php websocket server + demos + yii/yii2 integration + php 7 support,,PHP,False,False,master,23721,367,367,74,8,0,162,4,2014-01-24 20:53:40,2025-04-16 19:09:12,2019-05-01 14:38:17
16216776,k290-fnkeyctl,milgner/k290-fnkeyctl,160025,,Configures the behaviour of the F-keys on the Logitech K290,,Shell,False,False,master,38,223,223,29,9,0,25,10,2014-01-24 20:58:27,2025-04-16 21:35:39,2024-06-14 07:36:28
16217714,bepasty-server,bepasty/bepasty-server,6495625,6495625,universal pastebin server,https://bepasty-server.readthedocs.org/,Python,False,False,master,995,206,206,48,36,0,858,142,2014-01-24 21:37:55,2025-04-07 22:08:09,2024-03-06 12:11:25
16217814,json_resume,prat0318/json_resume,1528697,,"Generates pretty HTML, LaTeX, markdown, with biodata feeded as input in JSON",http://prat0318.github.io/json_resume,Ruby,False,False,master,2413,1359,1359,116,9,0,175,18,2014-01-24 21:42:44,2025-04-15 09:23:00,2018-06-18 07:08:57
16218877,robeaux,hybridgroup/robeaux,212109,212109,Universal dashboard to robotic devices based on React,http://robeaux.io,CSS,False,False,master,1372,127,127,16,5,0,95,13,2014-01-24 22:28:52,2025-02-04 18:35:17,2019-11-11 10:03:33
16218963,colourlovers,andrewheiss/colourlovers,73663,,🎨 📦  R Client for the COLOURlovers API,https://cloud.r-project.org/package=colourlovers,R,False,False,master,928,110,110,7,8,0,135,6,2014-01-24 22:32:08,2025-03-26 00:09:22,2022-08-18 23:21:50
16219137,links,links-lang/links,9572894,9572894,Links: Linking Theory to Practice for the Web,http://www.links-lang.org,OCaml,False,False,master,27783,337,337,43,167,0,2915,621,2014-01-24 22:40:35,2025-03-27 10:56:10,2025-03-27 10:56:07
16219236,ges-code,goldeneye-source/ges-code,5056312,5056312,GoldenEye: Source on SDK 2013,http://www.geshl2.com,C++,False,False,develop,438440,202,202,28,9,0,153,3,2014-01-24 22:44:42,2025-01-24 18:57:49,2018-09-27 01:58:37
16219967,phalconization,Riu/phalconization,213058,,Phalcon repositories on Github,,,False,False,master,18,119,119,30,0,0,35,4,2014-01-24 23:17:42,2025-04-14 19:18:03,2017-01-19 00:34:00
16220252,FrontYAML,mnapoli/FrontYAML,720328,,YAML Front matter parser,,PHP,False,False,master,60,285,285,29,1,0,79,23,2014-01-24 23:32:00,2025-01-29 09:02:31,2025-01-29 09:02:46
16221683,solo,chibicode/solo,992008,,":older_man: [UNMAINTAINED]: Solo is a Jekyll theme that supports single-page websites only, but supports them well.",http://chibicode.github.io/solo,CSS,False,False,gh-pages,40,321,321,171,1,0,51,24,2014-01-25 00:53:09,2025-02-15 11:26:14,2017-10-25 11:45:22
16222543,khaos,segment-boneyard/khaos,11205156,11205156,A super-simple way to scaffold new projects.,http://khaos.io,JavaScript,False,False,master,258,404,404,38,37,0,157,37,2014-01-25 01:47:40,2025-03-04 10:53:49,2020-07-15 20:22:07
16222895,react-autocomplete,eliseumds/react-autocomplete,640840,,Just tasting some ReactJS + RxJS,,JavaScript,False,False,master,3810,102,102,14,0,0,19,2,2014-01-25 02:13:00,2023-05-10 13:56:58,2014-07-08 13:27:07
16223378,openstacksdk,openstack/openstacksdk,324574,324574,Unified SDK for OpenStack. Mirror of code maintained at opendev.org.,https://opendev.org/openstack/openstacksdk,Python,False,False,master,19840,275,275,201,0,0,8049,17,2014-01-25 02:48:00,2025-04-17 11:04:47,2025-04-22 09:42:27
16223486,Font-Awesome-SVG-PNG,Rush/Font-Awesome-SVG-PNG,115926,,Font Awesome split to individual SVG and PNG files of different sizes along with Node.JS based generator,,JavaScript,False,False,master,48275,3227,3227,1663,20,0,97,24,2014-01-25 02:56:36,2025-04-21 14:35:28,2024-08-21 00:44:51
16223614,lunar-calendar,infinet/lunar-calendar,2721649,,"iCal农历, 节气, 传统节日",,Python,False,False,master,4074,897,897,177,1,0,69,5,2014-01-25 03:04:55,2025-04-21 06:36:10,2025-01-01 01:28:02
16223674,ServiceWire,tylerjensen/ServiceWire,4078516,4078516,ServiceWire is a very fast and light weight service host and dynamic client library that simplifies the development and use of high performance remote procedure call (RPC) communication between .NET processes over Named Pipes or TCP/IP.,,C#,False,False,master,3211,192,192,38,5,0,214,37,2014-01-25 03:09:38,2025-04-09 22:49:52,2024-12-14 18:48:45
16223898,gce,nousxiong/gce,6497289,,The Game Communication Environment (GCE) is an actor model framework for online game development.,,C++,False,False,master,1988,128,128,33,0,0,116,6,2014-01-25 03:25:26,2025-04-03 05:55:51,2017-07-25 08:58:05
16224312,izzy,baweaver/izzy,979723,,Mitigate long conditionals - DEPRECATED - Use Qo,,Ruby,False,False,master,18,113,113,4,0,0,21,2,2014-01-25 03:58:36,2025-01-24 15:47:52,2018-04-25 03:17:08
16224749,Colours,MatthewYork/Colours,3343852,,A beautiful set of predefined colors and a set of color methods to make your Android development life easier.,,Java,False,False,master,779,634,634,101,3,0,34,6,2014-01-25 04:31:10,2024-08-04 18:23:35,2017-12-13 06:30:09
16224965,eva01.vim,hachy/eva01.vim,1613863,,Vim/Neovim colorscheme 😈,https://hachy.github.io/eva01.vim/,Vim Script,False,False,main,12274,122,122,8,2,0,111,1,2014-01-25 04:47:43,2025-03-31 13:33:40,2025-03-31 13:33:36
16225067,MatterSlice,MatterHackers/MatterSlice,6200144,6200144,MatterSlice is a C# console application that generates GCode (hardware control) for 3D printing. It was originally ported from CuraEngine (another great open source 3D printing engine). It is the primary slicing engine for MatterSlice and under constant development.,,C#,False,False,main,11699,169,169,69,27,0,1905,532,2014-01-25 04:57:30,2025-04-20 00:50:41,2023-11-02 23:56:33
16225125,threestrap,unconed/threestrap,172808,,Minimal Three.js Bootstrapper,,JavaScript,False,False,master,2735,239,239,20,1,0,198,23,2014-01-25 05:02:07,2025-02-07 09:44:11,2023-01-07 17:10:52
16226063,conceal,facebookarchive/conceal,7560860,7560860,Conceal provides easy Android APIs for performing fast encryption and authentication of data.,http://facebook.github.io/conceal/,C++,False,False,master,43992,2956,2956,428,29,0,190,73,2014-01-25 06:22:49,2025-04-01 15:23:14,2019-01-22 20:01:11
16226209,ACReuseQueue,acoomans/ACReuseQueue,733352,,A queue to keep and reusing objects.,,Objective-C,False,False,master,208,368,368,21,3,0,6,2,2014-01-25 06:34:41,2025-04-04 16:59:22,2016-02-10 22:44:13
16226314,reagent-tutorial,jonase/reagent-tutorial,101023,,,,Clojure,False,False,master,215,111,111,13,5,0,13,4,2014-01-25 06:44:29,2024-05-17 16:41:50,2015-09-22 16:54:07
16227585,BeeHive,aliostad/BeeHive,487334,,A Reactive Cloud Actor library/mini-framework for .NET 4.5.2+ or .NET Standard 2.0+,,C#,False,False,master,1431,132,132,25,0,0,226,24,2014-01-25 08:39:07,2025-03-17 18:40:38,2022-06-30 19:46:33
16227592,factor-bundle,browserify/factor-bundle,6320506,6320506,factor browser-pack bundles into common shared bundles,,JavaScript,False,False,master,84,400,400,27,28,0,120,38,2014-01-25 08:39:45,2024-10-14 02:34:12,2024-12-21 10:15:37
16228229,Toast-PhoneGap-Plugin,EddyVerbruggen/Toast-PhoneGap-Plugin,1426370,,:beers: A Toast popup plugin for your fancy Cordova app,,C++,False,False,master,2038,511,511,276,41,0,149,25,2014-01-25 09:30:25,2025-03-19 00:44:38,2021-11-10 15:03:53
16228251,XHNewsFrameworkExample,JackTeam/XHNewsFrameworkExample,6082057,6082057,"XHNewsFramework是一个快速的集成和开发框架的新闻应用程序,在仿网易新闻应App的基础上完成的框架。XHNewsFramework is a fast integration and development of the framework of news app, base on Netease App build.",,Objective-C,False,False,master,31050,424,424,117,8,0,73,0,2014-01-25 09:32:27,2025-02-24 21:16:08,2016-03-16 17:28:22
16228662,hadoopecosystemtable.github.io,hadoopecosystemtable/hadoopecosystemtable.github.io,6499002,6499002,"This page is a summary to keep the track of Hadoop related projects, and relevant projects around Big Data scene focused on the open source, free software environment.",,HTML,False,False,master,564,692,692,410,6,0,203,63,2014-01-25 10:09:10,2025-02-07 16:31:29,2021-03-04 09:02:56
16229580,blog,livoras/blog,6436132,,"Too young, too simple. Sometimes, naive.",https://livoras.com,Ruby,False,False,home,22294,3521,3521,310,13,0,109,0,2014-01-25 11:17:41,2025-04-02 07:31:32,2016-05-22 01:21:07
16229596,color-identifiers-mode,ankurdave/color-identifiers-mode,408432,,Emacs minor mode to highlight each source code identifier uniquely based on its name,,Emacs Lisp,False,False,master,4146,320,320,24,6,0,204,75,2014-01-25 11:19:03,2025-03-19 07:58:43,2024-10-23 22:17:25
16229618,BetterFindBuffer,aziz/BetterFindBuffer,3202,,Adds a couple of missing features to SublimeText 3 Find Results buffer,,Python,False,False,master,31,107,107,31,15,0,47,17,2014-01-25 11:21:10,2023-05-29 09:14:17,2022-11-15 09:41:13
16229937,RenameIt,rodi01/RenameIt,52461,,"Keep your Sketch files organized, batch rename layers and artboards.",https://renameit.design/sketch/,JavaScript,False,False,master,19454,1406,1406,110,37,0,420,19,2014-01-25 11:46:08,2025-04-22 09:56:41,2021-05-07 09:16:03
16230125,essential-threejs,josdirksen/essential-threejs,1381917,,,,JavaScript,False,False,master,77690,147,147,66,4,0,37,4,2014-01-25 11:58:18,2025-03-27 18:53:55,2017-07-18 03:42:34
16230893,bootstrap-vz,andsens/bootstrap-vz,342823,,Bootstrap Debian images for virtualized environments,http://bootstrap-vz.readthedocs.io/,Python,False,False,master,2059,264,264,141,45,0,1625,293,2014-01-25 12:53:25,2025-03-18 09:23:02,2019-06-10 08:02:27
16231055,vindinium,ornicar/vindinium,140370,,Artificial Intelligence Challenge - scala game server,,JavaScript,False,False,master,4378,169,169,59,10,0,561,30,2014-01-25 13:02:45,2025-03-22 20:40:45,2019-03-05 00:04:08
16231426,NXEngine,EXL/NXEngine,232116,,"A port of the open-source rewrite Cave Story game engine for various platforms. Original author is Caitlin ""rogueeve"" Shaw, https://nxengine.sourceforge.io/",https://exlmoto.ru/nxengine/,C++,False,False,master,1154,186,186,36,1,0,74,8,2014-01-25 13:26:50,2025-04-18 00:07:11,2022-10-13 17:53:32
16231859,pako,nodeca/pako,723678,723678,"high speed zlib port to javascript, works in browser & node.js",http://nodeca.github.io/pako/,JavaScript,False,False,master,2546,5785,5785,797,26,0,375,61,2014-01-25 13:57:00,2025-04-22 10:00:34,2024-06-27 10:02:41
16233067,backbone-wordpress-theme,tollmanz/backbone-wordpress-theme,921795,,A stripped down example of a WordPress theme that utilizes Backbone.js,,PHP,False,False,master,167,135,135,17,2,0,11,1,2014-01-25 15:07:03,2025-03-06 13:35:15,2014-06-24 00:05:17
16234598,Dribbble_rebuild,NovelanceF/Dribbble_rebuild,5569254,,"a Dribbble client for android, building in android studio",,Java,False,False,master,16928,140,140,80,1,0,41,1,2014-01-25 16:27:41,2025-02-24 21:16:08,2014-03-03 06:07:51
16234816,BulletSharp,AndresTraks/BulletSharp,1055667,,.NET wrapper for the Bullet physics library,http://andrestraks.github.io/BulletSharp,C++,False,False,master,8457,288,288,60,9,0,665,12,2014-01-25 16:39:49,2025-04-22 03:36:45,2025-02-22 11:51:34
16236118,Submitty,Submitty/Submitty,10768785,10768785,"Homework Submission, Automated Grading, and TA grading system.",http://submitty.org,PHP,False,False,main,91003,691,691,897,691,0,8150,8095,2014-01-25 17:43:57,2025-04-21 16:03:56,2025-04-21 17:27:19
16236126,ONL,opennetworklinux/ONL,6486676,6486676,Please visit the Open Compute Project repository,https://github.com/opencomputeproject/OpenNetworkLinux,Makefile,False,False,master,7601,123,123,84,0,0,575,142,2014-01-25 17:44:22,2024-04-26 14:19:30,2018-05-02 16:46:29
16236480,mslinks,DmitriiShamrikov/mslinks,5540913,,Java library for parsing and creating Windows shortcut files (.lnk),,Java,False,False,master,241,150,150,36,2,0,77,3,2014-01-25 18:01:52,2025-04-09 22:42:02,2023-06-28 17:45:24
16236582,suitesparse-metis-for-windows,jlblancoc/suitesparse-metis-for-windows,5497818,,CMake scripts for painless usage of SuiteSparse+METIS from Visual Studio and the rest of Windows/Linux/OSX IDEs supported by CMake,,C,False,False,master,99513,457,457,218,2,0,201,51,2014-01-25 18:06:21,2025-04-09 03:08:03,2024-03-16 04:09:07
16237372,RootTools,Stericson/RootTools,121938,,RootTools Library,,Java,False,False,master,574,1636,1636,488,50,0,71,23,2014-01-25 18:48:42,2025-04-20 10:14:18,2021-12-07 15:41:31
16237680,sails-generate-auth,kasperisager/sails-generate-auth,1174718,,Generate a Passport.js authentication layer for your Sails app that will Rock Your Socks™,,JavaScript,False,False,master,167,398,398,65,0,0,149,51,2014-01-25 19:04:09,2025-04-21 09:30:14,2016-01-24 14:08:07
16238330,images,copy/images,1816456,,Some OSs to test v86,,,False,False,master,17789,138,138,39,1,0,10,2,2014-01-25 19:40:13,2025-03-30 19:54:42,2021-04-11 00:56:25
16238673,kanboard,kanboard/kanboard,13722943,13722943,Kanban project management software,https://kanboard.org,PHP,False,False,main,93347,8776,8776,1853,158,0,4649,1794,2014-01-25 19:58:30,2025-04-21 22:09:33,2025-04-18 22:56:08
16239114,croppic,sconsult/croppic,10435334,,croppic,,JavaScript,False,False,master,2254,914,914,228,122,0,44,53,2014-01-25 20:23:09,2024-09-23 10:34:42,2019-10-09 14:45:59
16239172,epaxos,go-distributed/epaxos,6145847,6145847,epaxos,,Go,False,False,master,1904,100,100,25,21,0,240,99,2014-01-25 20:26:18,2025-03-02 06:36:24,2015-11-26 15:39:09
16239427,NEMO,Neo-Mind/NEMO,4068357,,Neo Exe Modification Organizer,,Qt Script,False,False,pre_3p0,8854,110,110,121,48,0,163,16,2014-01-25 20:39:54,2025-04-15 21:29:27,2021-04-07 06:13:57
